title,date_announced,company_name,reference_number,url,assigned_category,sub_category
"MULTIPLE PROPOSALS VERTICE BERHAD (""VERTICE"" OR THE ""COMPANY"")
(I)	PROPOSED DISPOSAL; AND
(II)	PROPOSED PROVISION OF FINANCIAL ASSISTANCE
(COLLECTIVELY, REFERRED TO AS THE ""PROPOSALS"")",11/9/2020,VERTICE BERHAD,GA1-11092020-00062,https://disclosure.bursamalaysia.com/FileAccess/viewHtml/?e=3087645,General Announcement,Multiple Proposals
OTHERS SHARE GRANT SCHEME OF UP TO 15% OF THE TOTAL NUMBER OF ISSUED SHARES OF GREEN PACKET BERHAD (EXCLUDING TREASURY SHARES),11/9/2020,GREEN PACKET BERHAD,GA1-11092020-00036,https://disclosure.bursamalaysia.com/FileAccess/viewHtml/?e=3087748,General Announcement,OTHERS
"OTHERS RHB BANK BERHAD (""RHB BANK"")
DISPOSAL BY RHB INVESTMENT BANK BERHAD (""RHB INVESTMENT BANK""), A WHOLLY-OWNED SUBSIDIARY OF RHB BANK, OF ITS ENTIRE EQUITY INTEREST IN RHB SECURITIES SINGAPORE PTE LTD (""RHB SECURITIES SINGAPORE"") (""DISPOSAL"")",11/9/2020,RHB BANK BERHAD,GA1-11092020-00086,https://disclosure.bursamalaysia.com/FileAccess/viewHtml/?e=3087762,General Announcement,OTHERS
"MULTIPLE PROPOSALS SINO HUA-AN INTERNATIONAL BERHAD (""SHIB"" OR ""COMPANY"")
(i)	PROPOSED DEBT SETTLEMENT
(ii)	PROPOSED PRIVATE PLACEMENT
(COLLECTIVELY ""PROPOSALS"")",11/9/2020,SINO HUA-AN INTERNATIONAL BERHAD,GA1-11092020-00095,https://disclosure.bursamalaysia.com/FileAccess/viewHtml/?e=3087769,General Announcement,Multiple Proposals
"NEW ISSUE OF SECURITIES (CHAPTER 6 OF LISTING REQUIREMENTS) : OTHER ISSUE OF SECURITIES RANHILL UTILITIES BERHAD (FORMERLY KNOWN AS RANHILL HOLDINGS BERHAD) (""RANHILL OR THE COMPANY"")
ESTABLISHMENT OF A LONG TERM INCENTIVE PLAN OF UP TO 10% OF THE TOTAL NUMBER OF ISSUED RANHILL SHARES (EXCLUDING TREASURY SHARES, IF ANY) FOR ELIGIBLE EXECUTIVE DIRECTORS AND EMPLOYEES OF RANHILL AND ITS SUBSIDIARY COMPANIES (EXCLUDING SUBSIDIARIES WHICH ARE DORMANT) AT ANY POINT IN TIME (""LTIP"")",11/9/2020,RANHILL UTILITIES BERHAD,GA1-11092020-00054,https://disclosure.bursamalaysia.com/FileAccess/viewHtml/?e=3087770,General Announcement,New Issue of Securities (Chapter 6 of listing requirements)
"OTHERS RANHILL UTILITIES BERHAD (FORMERLY KNOWN AS RANHILL HOLDINGS BERHAD) (""RANHILL"" OR THE ""COMPANY"")
AWARD OF SHARES UNDER RANHILL'S LONG TERM INCENTIVE PLAN",11/9/2020,RANHILL UTILITIES BERHAD,GA1-11092020-00055,https://disclosure.bursamalaysia.com/FileAccess/viewHtml/?e=3087774,General Announcement,OTHERS
"TRANSACTIONS (CHAPTER 10 OF LISTING REQUIREMENTS) : RECURRENT RELATED PARTY TRANSACTIONS SEREMBAN ENGINEERING BERHAD (""SEB"" OR ""THE COMPANY"") - VARIATION BETWEEN ACTUAL VALUE AND ESTIMATED VALUE BY 10% OR MORE",11/9/2020,SEREMBAN ENGINEERING BERHAD,GA1-11092020-00092,https://disclosure.bursamalaysia.com/FileAccess/viewHtml/?e=3087776,General Announcement,Transactions (Chapter 10 of Listing Requirements)
"NEW ISSUE OF SECURITIES (CHAPTER 6 OF LISTING REQUIREMENTS) : BONUS ISSUES RUBBEREX CORPORATION (M) BERHAD (""RUBBEREX"" OR ""COMPANY"")
PROPOSED BONUS ISSUE OF 554,850,234 NEW ORDINARY SHARES IN RUBBEREX (""BONUS SHARE(S)"") ON THE BASIS OF 2 BONUS SHARES FOR EVERY 1 EXISTING ORDINARY SHARES IN RUBBEREX HELD AT AN ENTITLEMENT DATE TO BE DETERMINED LATER",11/9/2020,RUBBEREX CORPORATION (M) BERHAD,GA1-11092020-00116,https://disclosure.bursamalaysia.com/FileAccess/viewHtml/?e=3087783,General Announcement,New Issue of Securities (Chapter 6 of listing requirements)
"NEW ISSUE OF SECURITIES (CHAPTER 6 OF LISTING REQUIREMENTS) : COMBINATION OF NEW ISSUE OF SECURITIES GOODWAY INTEGRATED INDUSTRIES BERHAD (""GIIB"" OR THE ""COMPANY"")
(I)	PROPOSED DEBT CAPITALISATION;
(II)	PROPOSED SHARES ISSUANCE; AND
(III)	PROPOSED PRIVATE PLACEMENT
(COLLECTIVELY, REFERRED TO AS THE ""PROPOSALS"")",11/9/2020,GOODWAY INTEGRATED INDUSTRIES BERHAD,GA1-11092020-00035,https://disclosure.bursamalaysia.com/FileAccess/viewHtml/?e=3087784,General Announcement,New Issue of Securities (Chapter 6 of listing requirements)
"NEW ISSUE OF SECURITIES (CHAPTER 6 OF LISTING REQUIREMENTS) : FUND RAISING PASUKHAS GROUP BERHAD (""PASUKHAS"" OR THE ""COMPANY"")
PRIVATE PLACEMENT",11/9/2020,PASUKHAS GROUP BERHAD,GA1-11092020-00113,https://disclosure.bursamalaysia.com/FileAccess/viewHtml/?e=3087785,General Announcement,New Issue of Securities (Chapter 6 of listing requirements)
"NEW ISSUE OF SECURITIES (CHAPTER 6 OF LISTING REQUIREMENTS) : FUND RAISING LEWEKO RESOURCES BERHAD (""LEWEKO"" OR THE ""COMPANY"")
PROPOSED RENOUNCEABLE RIGHTS ISSUE OF 183,455,525 NEW ORDINARY SHARES IN LEWEKO (""LEWEKO SHARE(S)"" OR ""SHARE(S)"") (""RIGHTS SHARE(S)"") ON THE BASIS OF 1 RIGHTS SHARE FOR EVERY 2 EXISTING LEWEKO SHARES HELD, TOGETHER WITH 220,146,630 FREE DETACHABLE WARRANTS (""NEW WARRANT(S)"") ON THE BASIS OF 6 NEW WARRANTS FOR EVERY 5 RIGHTS SHARES SUBSCRIBED BY THE ENTITLED SHAREHOLDERS ON AN ENTITLEMENT DATE TO BE DETERMINED LATER (""PROPOSED RIGHTS ISSUE"")",11/9/2020,LEWEKO RESOURCES BERHAD,GA1-11092020-00097,https://disclosure.bursamalaysia.com/FileAccess/viewHtml/?e=3087789,General Announcement,New Issue of Securities (Chapter 6 of listing requirements)
OTHERS RESIGNATION OF AUDITORS,11/9/2020,POWERWELL HOLDINGS BERHAD,GA1-11092020-00085,https://disclosure.bursamalaysia.com/FileAccess/viewHtml/?e=3087791,General Announcement,OTHERS
"MULTIPLE PROPOSALS TA WIN HOLDINGS BERHAD (""TA WIN"" OR THE ""COMPANY"")
(I)	PROPOSED ACQUISITION; AND
(II)	PROPOSED SUBSCRIPTION
(COLLECTIVELY REFERRED TO AS THE ""PROPOSED INVESTMENT"")",14/9/2020,TA WIN HOLDINGS BERHAD,GA1-13092020-00005,https://disclosure.bursamalaysia.com/FileAccess/viewHtml/?e=3087842,General Announcement,Multiple Proposals
"OTHERS GPA Holdings Berhad or ""the Company""
- Proposed Shareholders' Mandate to allot and issue shares",14/9/2020,GPA HOLDINGS BERHAD,GA1-14092020-00023,https://disclosure.bursamalaysia.com/FileAccess/viewHtml/?e=3087852,General Announcement,OTHERS
"MULTIPLE PROPOSALS SUNWAY REAL ESTATE INVESTMENT TRUST (""SUNWAY REIT"")
I. PROPOSED ACQUISITION OF THE PINNACLE SUNWAY BY SUNWAY REIT FOR A CASH CONSIDERATION OF RM450.0 MILLION;
II. PROPOSED PRIVATE PLACEMENT TO RAISE GROSS PROCEEDS OF UP TO RM710.0 MILLION AT THE ISSUE PRICE TO BE DETERMINED LATER BY WAY OF BOOKBUILDING; AND
III. PROPOSED ESTABLISHMENT OF A DISTRIBUTION REINVESTMENT SCHEME",14/9/2020,SUNWAY REAL ESTATE INVESTMENT TRUST,GA1-14092020-00019,https://disclosure.bursamalaysia.com/FileAccess/viewHtml/?e=3087856,General Announcement,Multiple Proposals
MACPIE - Unusual Market Activity,14/9/2020,MACPIE BERHAD,ILC-14092020-00003,https://disclosure.bursamalaysia.com/FileAccess/viewHtml/?e=3087873,Unusual Market Activity,UMA Query by Bursa
"OTHERS IBRACO BERHAD (""IBRACO"" OR ""THE COMPANY"")
RELEASE OF REMAND ORDER AGAINST A COMPANY DIRECTOR",14/9/2020,IBRACO BERHAD,GA1-14092020-00067,https://disclosure.bursamalaysia.com/FileAccess/viewHtml/?e=3087890,General Announcement,OTHERS
"OTHERS EWEIN BERHAD (""EWEIN"" OR ""THE COMPANY"")
Termination of Memorandum of Agreement dated 14 January 2016 entered into between Ewein Zenith Sdn. Bhd. (""EZ"") with Consortium Zenith Construction Sdn. Bhd. (""CZCSB"") (formerly known as Consortium Zenith BUCG Sdn. Bhd.)",14/9/2020,EWEIN BERHAD,GA1-14092020-00037,https://disclosure.bursamalaysia.com/FileAccess/viewHtml/?e=3087896,General Announcement,OTHERS
"OTHERS LKL INTERNATIONAL BERHAD (""LKL INTERNATIONAL"" OR THE ""COMPANY"")
- SALES CONTRACT AWARDED TO LKL ADVANCE METALTECH SDN. BHD. (""LKLAM""), A WHOLLY-OWNED SUBSIDIARY OF LKL INTERNATIONAL, FOR THE SUPPLY OF NITRILE GLOVES",14/9/2020,LKL INTERNATIONAL BERHAD,GA1-14092020-00038,https://disclosure.bursamalaysia.com/FileAccess/viewHtml/?e=3087908,General Announcement,OTHERS
"NEW ISSUE OF SECURITIES (CHAPTER 6 OF LISTING REQUIREMENTS) : FUND RAISING ASIA POLY HOLDINGS BERHAD (""ASIA POLY"" OR THE ""COMPANY"")
PRIVATE PLACEMENT",14/9/2020,ASIA POLY HOLDINGS BERHAD,GA1-14092020-00060,https://disclosure.bursamalaysia.com/FileAccess/viewHtml/?e=3087929,General Announcement,New Issue of Securities (Chapter 6 of listing requirements)
"NEW ISSUE OF SECURITIES (CHAPTER 6 OF LISTING REQUIREMENTS) : FUND RAISING VORTEX CONSOLIDATED BERHAD (""VORTEX"" OR THE ""COMPANY"")
PROPOSED PRIVATE PLACEMENT OF NEW ORDINARY SHARES IN VORTEX (""VORTEX SHARE(S)""), REPRESENTING NOT MORE THAN 10% OF THE NUMBER OF VORTEX SHARES IN ISSUE (EXCLUDING ANY TREASURY SHARES) (""PROPOSED PRIVATE PLACEMENT"")",14/9/2020,VORTEX CONSOLIDATED BERHAD,GA1-14092020-00014,https://disclosure.bursamalaysia.com/FileAccess/viewHtml/?e=3087946,General Announcement,New Issue of Securities (Chapter 6 of listing requirements)
"MULTIPLE PROPOSALS MATRIX PARKING SOLUTION HOLDINGS BERHAD (""MATRIX"" OR ""COMPANY"")
(I)	PROPOSED BONUS ISSUE OF WARRANTS;
(II)	PROPOSED ACQUISITION OF SITSB;
(III)	PROPOSED ACQUISITION OF PBSB; AND
(IV)	PROPOSED PRIVATE PLACEMENT
(COLLECTIVELY, THE ""PROPOSALS"")",14/9/2020,MATRIX PARKING SOLUTION HOLDINGS BERHAD,GA1-14092020-00082,https://disclosure.bursamalaysia.com/FileAccess/viewHtml/?e=3088001,General Announcement,Multiple Proposals
"OTHERS EKSONS CORPORATION BERHAD (""EKSONS"" OR ""COMPANY"")
ARBITRATION PROCEEDINGS BETWEEN THE ATMOSPHERE SDN BHD AND MULTI BUILDERS SDN BHD",14/9/2020,EKSONS CORPORATION BERHAD,GA1-14092020-00055,https://disclosure.bursamalaysia.com/FileAccess/viewHtml/?e=3088023,General Announcement,OTHERS
"MULTIPLE PROPOSALS SARAWAK CONSOLIDATED INDUSTRIES BERHAD (""SCIB"" OR THE ""COMPANY"")
I.	PROPOSED BONUS ISSUE OF SHARES; AND
II.	PROPOSED ISSUE OF FREE WARRANTS
(COLLECTIVELY REFERRED TO AS THE ""PROPOSALS"")",14/9/2020,SARAWAK CONSOLIDATED INDUSTRIES BERHAD,GA1-14092020-00043,https://disclosure.bursamalaysia.com/FileAccess/viewHtml/?e=3088029,General Announcement,Multiple Proposals
"NEW ISSUE OF SECURITIES (CHAPTER 6 OF LISTING REQUIREMENTS) : FUND RAISING PASUKHAS GROUP BEHAD (""PASUKHAS"" OR THE ""COMPANY"")
PRIVATE PLACEMENT",14/9/2020,PASUKHAS GROUP BERHAD,GA1-14092020-00033,https://disclosure.bursamalaysia.com/FileAccess/viewHtml/?e=3088056,General Announcement,New Issue of Securities (Chapter 6 of listing requirements)
"NEW ISSUE OF SECURITIES (CHAPTER 6 OF LISTING REQUIREMENTS) : FUND RAISING MTOUCHE TECHNOLOGY BERHAD (""MTOUCHE"" OR THE ""COMPANY"")
PRIVATE PLACEMENT OF UP TO 30% OF THE TOTAL NUMBER OF ISSUED SHARES OF MTOUCHE (""PRIVATE PLACEMENT"")",14/9/2020,MTOUCHE TECHNOLOGY BERHAD,GA1-14092020-00088,https://disclosure.bursamalaysia.com/FileAccess/viewHtml/?e=3088058,General Announcement,New Issue of Securities (Chapter 6 of listing requirements)
"OTHERS IOI Properties Group Berhad (""IOIPG"" or the ""Company"")
- Proposed Renewal of Existing Share Buy-Back Authority",14/9/2020,IOI PROPERTIES GROUP BERHAD,GA1-03092020-00016,https://disclosure.bursamalaysia.com/FileAccess/viewHtml/?e=3088064,General Announcement,OTHERS
OTHERS NEW CONTRACT AWARDED,14/9/2020,WILLOWGLEN MSC BERHAD,GA1-14092020-00093,https://disclosure.bursamalaysia.com/FileAccess/viewHtml/?e=3088090,General Announcement,OTHERS
"NEW ISSUE OF SECURITIES (CHAPTER 6 OF LISTING REQUIREMENTS) : FUND RAISING LAMBO GROUP BERHAD (""LAMBO"" OR THE ""COMPANY"")
PROPOSED PRIVATE PLACEMENT OF UP TO 813,303,899 NEW ORDINARY SHARES IN LAMBO, REPRESENTING UP TO APPROXIMATELY 30% OF THE TOTAL NUMBER OF ISSUED SHARES OF LAMBO, TO INDEPENDENT THIRD PARTY INVESTOR(S) TO BE IDENTIFIED LATER AT AN ISSUE PRICE TO BE DETERMINED LATER",14/9/2020,LAMBO GROUP BERHAD,GA1-14092020-00086,https://disclosure.bursamalaysia.com/FileAccess/viewHtml/?e=3088094,General Announcement,New Issue of Securities (Chapter 6 of listing requirements)
"OTHERS AT SYSTEMATIZATION BERHAD (""AT"" OR ""THE COMPANY"")
- OFFER OF OPTIONS UNDER SHARE ISSUANCE SCHEME (""SIS"")",14/9/2020,AT SYSTEMATIZATION BERHAD,GA1-11092020-00030,https://disclosure.bursamalaysia.com/FileAccess/viewHtml/?e=3088096,General Announcement,OTHERS
"MULTIPLE PROPOSALS ACME HOLDINGS BERHAD (""ACME"" OR ""COMPANY"")
(I)	BONUS ISSUE OF WARRANTS;
(II)	PRIVATE PLACEMENT;
(III)	MEDAN ACQUISITION; AND
(IV)	FOCAL ACQUISITION
(COLLECTIVELY REFERRED TO AS THE ""CORPORATE EXERCISES"")",14/9/2020,ACME HOLDINGS BERHAD,GA1-14092020-00087,https://disclosure.bursamalaysia.com/FileAccess/viewHtml/?e=3088115,General Announcement,Multiple Proposals
"OTHERS SCOMI ENERGY SERVICES BHD (""SESB"" OR ""THE COMPANY"")
- DEFAULT IN PAYMENT PURSUANT TO PARAGRAPH 9.19A OF BURSA MALAYSIA SECURITIES BERHAD'S MAIN MARKET LISTING REQUIREMENTS",14/9/2020,SCOMI ENERGY SERVICES BHD,GA1-11092020-00093,https://disclosure.bursamalaysia.com/FileAccess/viewHtml/?e=3088120,General Announcement,OTHERS
"MEMORANDUM OF UNDERSTANDING TH HEAVY ENGINEERING BERHAD (""THHE"" OR ""COMPANY"")
MEMORANDUM OF UNDERSTANDING ENTERED INTO BETWEEN THHE AND ICE PETROLEUM VENTURES SDN BHD",14/9/2020,TH HEAVY ENGINEERING BERHAD,GA1-14092020-00108,https://disclosure.bursamalaysia.com/FileAccess/viewHtml/?e=3088140,General Announcement,Memorandum of Understanding
"NEW ISSUE OF SECURITIES (CHAPTER 6 OF LISTING REQUIREMENTS) : FUND RAISING INSAS BERHAD (""INSAS"" OR ""COMPANY"")
- PROPOSED RIGHTS ISSUE WITH WARRANTS; AND
- PROPOSED AMENDMENTS
(COLLECTIVELY, THE ""PROPOSALS"")",14/9/2020,INSAS BERHAD,GA1-14092020-00109,https://disclosure.bursamalaysia.com/FileAccess/viewHtml/?e=3088141,General Announcement,New Issue of Securities (Chapter 6 of listing requirements)
Letter Subject or Reference - UNUSUAL MARKET ACTIVITY,14/9/2020,MACPIE BERHAD,GA1-14092020-00105,https://disclosure.bursamalaysia.com/FileAccess/viewHtml/?e=3088149,Unusual Market Activity,Reply to UMA Query
"OTHERS PRESTARIANG BERHAD (""PRESTARIANG"" OR ""THE COMPANY"")
- STATUS OF PRESTARIANG SYSTEMS SDN. BHD. (""PSSB"") AS CHANNEL PARTNER OF MICROSOFT REGIONAL SALES PTE. LTD. (""MICROSOFT"")",15/9/2020,PRESTARIANG BERHAD,GA1-14092020-00117,https://disclosure.bursamalaysia.com/FileAccess/viewHtml/?e=3088156,General Announcement,OTHERS
PARLO - Unusual Market Activity,15/9/2020,PARLO BERHAD,ILC-15092020-00005,https://disclosure.bursamalaysia.com/FileAccess/viewHtml/?e=3088176,Unusual Market Activity,UMA Query by Bursa
"OTHERS OMESTI BERHAD
LETTER OF AWARD FROM JABATAN PENGANGKUTAN JALAN MALAYSIA",15/9/2020,OMESTI BERHAD,GA1-14092020-00065,https://disclosure.bursamalaysia.com/FileAccess/viewHtml/?e=3088191,General Announcement,OTHERS
"MULTIPLE PROPOSALS TA WIN HOLDINGS BERHAD (""TA WIN"" OR THE ""COMPANY"")
(I)	PROPOSED RIGHTS ISSUE;
(II)	PROPOSED DIVERSIFICATION; AND
(III)	PROPOSED SHARE BUY-BACK
(COLLECTIVELY, REFERRED TO AS THE ""PROPOSALS"")",15/9/2020,TA WIN HOLDINGS BERHAD,GA1-15092020-00039,https://disclosure.bursamalaysia.com/FileAccess/viewHtml/?e=3088194,General Announcement,Multiple Proposals
"OTHERS SURAT SETUJU TERIMA PERKHIDMATAN PENYELENGGARAAN DAN PEMBAHARUAN LESEN SISTEM MYGST UNTUK TAHUN 2020 HINGGA 2022 DI JABATAN KASTAM DIRAJA MALAYSIA (JKDM) BERJUMLAH RM42,010,604.82 TERMASUK CUKAI PERKHIDMATAN.",15/9/2020,MESINIAGA BERHAD,GA1-11092020-00024,https://disclosure.bursamalaysia.com/FileAccess/viewHtml/?e=3088204,General Announcement,OTHERS
MALTON - Unusual Market Activity,15/9/2020,MALTON BERHAD,ILC-15092020-00006,https://disclosure.bursamalaysia.com/FileAccess/viewHtml/?e=3088210,Unusual Market Activity,UMA Query by Bursa
"NEW ISSUE OF SECURITIES (CHAPTER 6 OF LISTING REQUIREMENTS) : FUND RAISING HIBISCUS PETROLEUM BERHAD (""HIBISCUS PETROLEUM"" OR ""THE COMPANY"")
(I)	PROPOSED PRIVATE PLACEMENT OF CRPS; AND
(II)	PROPOSED AMENDMENTS
(COLLECTIVELY REFERRED TO AS THE ""PROPOSALS"")",15/9/2020,HIBISCUS PETROLEUM BERHAD,GA1-15092020-00078,https://disclosure.bursamalaysia.com/FileAccess/viewHtml/?e=3088240,General Announcement,New Issue of Securities (Chapter 6 of listing requirements)
OTHERS APPOINTMENT OF CHIEF EXECUTIVE OFFICER,15/9/2020,ZELAN BERHAD,GA1-14092020-00063,https://disclosure.bursamalaysia.com/FileAccess/viewHtml/?e=3088257,General Announcement,OTHERS
"NEW ISSUE OF SECURITIES (CHAPTER 6 OF LISTING REQUIREMENTS) : OTHER ISSUE OF SECURITIES CAPITALAND MALAYSIA MALL TRUST (""CMMT"")
DISTRIBUTION REINVESTMENT PLAN WHICH WILL PROVIDE UNITHOLDERS OF CMMT WITH AN OPTION TO ELECT TO REINVEST THEIR CASH DISTRIBUTION IN NEW UNITS OF CMMT (""DRP"")",15/9/2020,CAPITALAND MALAYSIA MALL TRUST,GA1-15092020-00093,https://disclosure.bursamalaysia.com/FileAccess/viewHtml/?e=3088279,General Announcement,New Issue of Securities (Chapter 6 of listing requirements)
"TRANSACTIONS (CHAPTER 10 OF LISTING REQUIREMENTS) : NON RELATED PARTY TRANSACTIONS REVENUE GROUP BERHAD (REVENUE OR COMPANY)
(I) ACQUISITION BY REVENUE HARVEST SDN BHD (REVENUE HARVEST), A WHOLLY-OWNED SUBSIDIARY OF REVENUE, OF 51.0% EQUITY INTEREST IN BUYMALL SERVICES SDN BHD (BUYMALL) FOR A TOTAL PURCHASE CONSIDERATION OF RM3,315,000 (ACQUISITION OF BUYMALL); AND
(II)	ACQUISITION BY REVENUE HARVEST OF 70.0% EQUITY INTEREST IN ANYPAY SDN BHD (ANYPAY) FOR A TOTAL PURCHASE CONSIDERATION OF RM4,900,000 (ACQUISITION OF ANYPAY)
(COLLECTIVELY KNOWN AS ACQUISITIONS)",15/9/2020,REVENUE GROUP BERHAD,GA1-15092020-00073,https://disclosure.bursamalaysia.com/FileAccess/viewHtml/?e=3088282,General Announcement,Transactions (Chapter 10 of Listing Requirements)
"NEW ISSUE OF SECURITIES (CHAPTER 6 OF LISTING REQUIREMENTS) : FUND RAISING PRICEWORTH INTERNATIONAL BERHAD (""PWI"" OR THE ""COMPANY"")
PRIVATE PLACEMENT OF NEW ORDINARY SHARES IN PWI (""PWI SHARES"" OR ""SHARES"") (""PLACEMENT SHARES"") OF UP TO 10% OF THE TOTAL NUMBER OF ISSUED SHARES OF PWI (EXCLUDING TREASURY SHARES, IF ANY) (""PRIVATE PLACEMENT"")",15/9/2020,PRICEWORTH INTERNATIONAL BERHAD,GA1-10092020-00016,https://disclosure.bursamalaysia.com/FileAccess/viewHtml/?e=3088286,General Announcement,New Issue of Securities (Chapter 6 of listing requirements)
"OTHERS MQ TECHNOLOGY BERHAD (MQ TECH OR THE COMPANY)
INVESTMENT AND COLLABORATION JOINT VENTURE AGREEMENT",15/9/2020,MQ TECHNOLOGY BERHAD,GA1-15092020-00086,https://disclosure.bursamalaysia.com/FileAccess/viewHtml/?e=3088304,General Announcement,OTHERS
Letter Subject or Reference - UNUSUAL MARKET ACTIVITY,15/9/2020,PARLO BERHAD,GA1-15092020-00058,https://disclosure.bursamalaysia.com/FileAccess/viewHtml/?e=3088325,Unusual Market Activity,Reply to UMA Query
"NEW ISSUE OF SECURITIES (CHAPTER 6 OF LISTING REQUIREMENTS) : FUND RAISING SASBADI HOLDINGS BERHAD (""SASBADI HOLDINGS"" OR ""COMPANY"")
PROPOSED PRIVATE PLACEMENT OF UP TO 42,909,850 NEW ORDINARY SHARES IN SASBADI HOLDINGS (""SASBADI HOLDINGS SHARE(S)"" OR ""SHARE(S)"") (""PLACEMENT SHARE(S)""), REPRESENTING TEN PERCENT (10%) OF THE TOTAL NUMBER OF ISSUED SHARES (EXCLUDING TREASURY SHARES) OF SASBADI HOLDINGS (""PROPOSED PRIVATE PLACEMENT"")",15/9/2020,SASBADI HOLDINGS BERHAD,GA1-15092020-00070,https://disclosure.bursamalaysia.com/FileAccess/viewHtml/?e=3088348,General Announcement,New Issue of Securities (Chapter 6 of listing requirements)
PRACTICE NOTE 17 / GUIDANCE NOTE 3 : OTHERS,15/9/2020,DAYA MATERIALS BERHAD,GA1-15092020-00029,https://disclosure.bursamalaysia.com/FileAccess/viewHtml/?e=3088349,General Announcement,OTHERS
"NEW ISSUE OF SECURITIES (CHAPTER 6 OF LISTING REQUIREMENTS) : FUND RAISING UCrest Berhad (""UCrest"" or ""Company"") and its subsidiary companies (""UCrest Group"" or ""Group"")
-	Proposed Private Placement",15/9/2020,UCREST BERHAD,GA1-15092020-00106,https://disclosure.bursamalaysia.com/FileAccess/viewHtml/?e=3088392,General Announcement,New Issue of Securities (Chapter 6 of listing requirements)
"OTHERS (I)	PROPOSED RENEWAL OF EXISTING SHARE BUY-BACK AUTHORITY
(II)	PROPOSED RENEWAL OF SHAREHOLDERS MANDATE FOR RECURRENT RELATED PARTY TRANSACTIONS
OF A REVENUE OR TRADING NATURE",15/9/2020,IOI CORPORATION BERHAD,GA1-12092019-00038,https://disclosure.bursamalaysia.com/FileAccess/viewHtml/?e=3088408,General Announcement,OTHERS
"OTHERS GREEN PACKET BERHAD (GREEN PACKET OR THE COMPANY)
TERM SHEET IN RELATION TO THE PROPOSED ACQUISITION OF 100% STAKE IN XENDITY PTE LTD (""PROPOSED ACQUISITION"")",15/9/2020,GREEN PACKET BERHAD,GA1-15092020-00103,https://disclosure.bursamalaysia.com/FileAccess/viewHtml/?e=3088409,General Announcement,OTHERS
"MULTIPLE PROPOSALS NI HSIN RESOURCES BERHAD (""NI HSIN"" OR ""COMPANY"")
(I)	PROPOSED RIGHTS ISSUE OF RCPS;
(II)	PROPOSED DIVERSIFICATION; AND
(III)	PROPOSED AMENDMENTS
(COLLECTIVELY REFERRED TO AS THE ""PROPOSALS"")",15/9/2020,NI HSIN RESOURCES BERHAD,GA1-15092020-00094,https://disclosure.bursamalaysia.com/FileAccess/viewHtml/?e=3088418,General Announcement,Multiple Proposals
"OTHERS BRAHIMS HOLDINGS BERHAD (""BRAHIMS"" OR ""THE COMPANY"")
HEADS OF AGREEMENT BETWEEN BRAHIMS AND MRI VC BERHAD",15/9/2020,BRAHIM'S HOLDINGS BERHAD,GA1-15092020-00115,https://disclosure.bursamalaysia.com/FileAccess/viewHtml/?e=3088439,General Announcement,OTHERS
"OTHERS INDUSTRONICS BERHAD (ITRONIC OR THE COMPANY)
- Acquisition of a new subsidiary, All Best Group Limited (Incorporated in Hong Kong)",15/9/2020,INDUSTRONICS BERHAD,GA1-15092020-00076,https://disclosure.bursamalaysia.com/FileAccess/viewHtml/?e=3088445,General Announcement,OTHERS
NEW ISSUE OF SECURITIES (CHAPTER 6 OF LISTING REQUIREMENTS) : FUND RAISING PROPOSED PRIVATE PLACEMENT,15/9/2020,BINTAI KINDEN CORPORATION BERHAD,GA1-15092020-00113,https://disclosure.bursamalaysia.com/FileAccess/viewHtml/?e=3088448,General Announcement,New Issue of Securities (Chapter 6 of listing requirements)
Letter Subject or Reference - UNUSUAL MARKET ACTIVITY,15/9/2020,MALTON BERHAD,GA1-15092020-00087,https://disclosure.bursamalaysia.com/FileAccess/viewHtml/?e=3088466,Unusual Market Activity,Reply to UMA Query
"OTHERS ECOFIRST CONSOLIDATED BHD (""ECB"" OR ""THE COMPANY"")
(I) PROPOSED RENEWAL OF SHAREHOLDERS' MANDATE FOR RECURRENT RELATED PARTY TRANSACTIONS OF A REVENUE OR TRADING NATURE
(II) PROPOSED RENEWAL OF SHARE BUY-BACK AUTHORITY",15/9/2020,ECOFIRST CONSOLIDATED BHD,GA1-09092020-00040,https://disclosure.bursamalaysia.com/FileAccess/viewHtml/?e=3088469,General Announcement,OTHERS
"OTHERS AirAsia X Berhad (""AAX"" or ""the Company"")
- Extension of the Shareholders' Benefit Programme and AGM 2019 Complimentary Flight Vouchers",15/9/2020,AIRASIA X BERHAD,GA1-15092020-00038,https://disclosure.bursamalaysia.com/FileAccess/viewHtml/?e=3088474,General Announcement,OTHERS
"OTHERS M N C WIRELESS BERHAD (""MNC"" OR ""COMPANY"")
- OFFER AND GRANT OF OPTIONS UNDER EMPLOYEES SHARE OPTION SCHEME (""ESOS"") OF THE COMPANY",15/9/2020,M N C WIRELESS BERHAD,GA1-15092020-00089,https://disclosure.bursamalaysia.com/FileAccess/viewHtml/?e=3088475,General Announcement,OTHERS
"STATUS OF PRESTARIANG SYSTEMS SDN BHD AS A CHANNEL PARTNER OF MICROSOFT REGIONAL SALES PTE. LTD. (""MICROSOFT"")",15/9/2020,PRESTARIANG BERHAD,GA1-15092020-00090,https://disclosure.bursamalaysia.com/FileAccess/viewHtml/?e=3088487,Reply to Query,-
"TRANSACTIONS (CHAPTER 10 OF LISTING REQUIREMENTS) : NON RELATED PARTY TRANSACTIONS KOSSAN RUBBER INDUSTRIES BHD. (""KOSSAN"" OR ""COMPANY"") PROPOSED DISPOSAL BY IDEAL QUALITY SDN. BHD. (199601032612(404964-P)) (""IQ"" OR ""VENDOR""), A WHOLLY-OWNED SUBSIDIARY OF KOSSAN, OF THE VACANT FREEHOLD INDUSTRIAL LAND TO BEST ETERNITY RECYCLE TECHNOLOGY SDN. BHD. (201801017328 (1279344-A)) (""BERT"" OR ""PURCHASER"") FOR A TOTAL CASH CONSIDERATION OF RM153,380,091.00) (""PROPOSED DISPOSAL"")",15/9/2020,KOSSAN RUBBER INDUSTRIES BERHAD,GA1-15092020-00116,https://disclosure.bursamalaysia.com/FileAccess/viewHtml/?e=3088496,General Announcement,Transactions (Chapter 10 of Listing Requirements)
"NEW ISSUE OF SECURITIES (CHAPTER 6 OF LISTING REQUIREMENTS) : FUND RAISING MACPIE BERHAD (""MACPIE"" OR THE ""COMPANY"")
PROPOSED PRIVATE PLACEMENT OF NEW ORDINARY SHARES IN MACPIE (""MACPIE SHARES""), REPRESENTING NOT MORE THAN 10% OF THE ENLARGED NUMBER OF MACPIE SHARES IN ISSUE (EXCLUDING ANY TREASURY SHARES) (""PROPOSED PRIVATE PLACEMENT"")",15/9/2020,MACPIE BERHAD,GA1-15092020-00124,https://disclosure.bursamalaysia.com/FileAccess/viewHtml/?e=3088519,General Announcement,New Issue of Securities (Chapter 6 of listing requirements)
"MEMORANDUM OF UNDERSTANDING MEMORANDUM OF UNDERSTANDING ENTERED INTO BETWEEN GIVNFLOW CO. LTD (VIETNAM) (""GIVNFLOW"" OR ""SELLER""), A WHOLLY-OWNED SUBSIDIARY OF GIM TRIPLE SEVEN SDN BHD (""GTS""), WHICH IN TURN IS A WHOLLY-OWNED SUBSIDIARY OF GREENYIELD BERHAD (""GREENYIELD"" OR ""THE COMPANY""), AND SNP CO. LTD (""SNP"" OR ""BUYER"")",17/9/2020,GREENYIELD BERHAD,GA1-10092020-00006,https://disclosure.bursamalaysia.com/FileAccess/viewHtml/?e=3088662,General Announcement,Memorandum of Understanding
"OTHERS PROPOSED ISSUANCE OF ISLAMIC MEDIUM TERM NOTES (""SUKUK MURABAHAH"") PURSUANT TO AN ISLAMIC MEDIUM TERM NOTES PROGRAMME OF UP TO RM3.0 BILLION IN NOMINAL VALUE BASED ON THE SHARIAH PRINCIPLE OF MURABAHAH (VIA TAWARRUQ ARRANGEMENT) (""SUKUK MURABAHAH PROGRAMME"") BY PENGERANG LNG (TWO) SDN BHD",17/9/2020,PETRONAS GAS BERHAD,GA1-17092020-00010,https://disclosure.bursamalaysia.com/FileAccess/viewHtml/?e=3088671,General Announcement,OTHERS
"OTHERS Top Glove Corporation Bhd (""Top Glove"" or ""the Company"")
Proposed Renewal of Share Buy-Back Authority",17/9/2020,TOP GLOVE CORPORATION BHD,GA1-13092020-00001,https://disclosure.bursamalaysia.com/FileAccess/viewHtml/?e=3088676,General Announcement,OTHERS
"NEW ISSUE OF SECURITIES (CHAPTER 6 OF LISTING REQUIREMENTS) : FUND RAISING OCEANCASH PACIFIC BERHAD (""OCEANCASH"" OR THE ""COMPANY"")
PLACEMENT OF UP TO 24,500,000 NEW ORDINARY SHARES IN OCEANCASH (""PLACEMENT"")",17/9/2020,OCEANCASH PACIFIC BERHAD,GA1-17092020-00015,https://disclosure.bursamalaysia.com/FileAccess/viewHtml/?e=3088734,General Announcement,New Issue of Securities (Chapter 6 of listing requirements)
OTHERS DECLARATION OF AN INTERIM CASH DIVIDEND FOR THE FINANCIAL YEAR ENDING 31 MARCH 2021,17/9/2020,MNRB HOLDINGS BERHAD,GA1-14092020-00114,https://disclosure.bursamalaysia.com/FileAccess/viewHtml/?e=3088747,General Announcement,OTHERS
