title,date_announced,company_name,reference_number,url,assigned_category,sub_category
"NEW ISSUE OF SECURITIES (CHAPTER 6 OF LISTING REQUIREMENTS) : FUND RAISING NWP HOLDINGS BERHAD (""NWP"")
PROPOSED PRIVATE PLACEMENT",16/10/2020,NWP HOLDINGS BERHAD,GA1-15102020-00110,https://disclosure.bursamalaysia.com/FileAccess/viewHtml/?e=3096898,General Announcement,New Issue of Securities (Chapter 6 of listing requirements)
"MEMORANDUM OF UNDERSTANDING Memorandum of Understanding Between JHM Consolidation Berhad and MASS Precision, Inc.",16/10/2020,JHM CONSOLIDATION BERHAD,GA1-16102020-00067,https://disclosure.bursamalaysia.com/FileAccess/viewHtml/?e=3096941,General Announcement,Memorandum of Understanding
"NEW ISSUE OF SECURITIES (CHAPTER 6 OF LISTING REQUIREMENTS) : BONUS ISSUES UNI WALL APS HOLDINGS BERHAD (""UNI WALL"" OR THE ""COMPANY"")
BONUS ISSUE",16/10/2020,UNI WALL APS HOLDINGS BERHAD,GA1-16102020-00040,https://disclosure.bursamalaysia.com/FileAccess/viewHtml/?e=3097010,General Announcement,New Issue of Securities (Chapter 6 of listing requirements)
"NEW ISSUE OF SECURITIES (CHAPTER 6 OF LISTING REQUIREMENTS) : FUND RAISING AT SYSTEMATIZATION BERHAD (""ATS"" OR THE ""COMPANY"")
PRIVATE PLACEMENT",16/10/2020,AT SYSTEMATIZATION BERHAD,GA1-16102020-00079,https://disclosure.bursamalaysia.com/FileAccess/viewHtml/?e=3097021,General Announcement,New Issue of Securities (Chapter 6 of listing requirements)
"NEW ISSUE OF SECURITIES (CHAPTER 6 OF LISTING REQUIREMENTS) : FUND RAISING ALAM MARITIM RESOURCES BERHAD (""AMRB"" OR THE ""COMPANY"")
I.	PRIVATE PLACEMENT I; AND
II.	PRIVATE PLACEMENT II
(COLLECTIVELY REFERRED TO AS THE ""PROPOSALS"")",16/10/2020,ALAM MARITIM RESOURCES BERHAD,GA1-16102020-00065,https://disclosure.bursamalaysia.com/FileAccess/viewHtml/?e=3097037,General Announcement,New Issue of Securities (Chapter 6 of listing requirements)
PRACTICE NOTE 17 / GUIDANCE NOTE 3 : OTHERS,16/10/2020,MAA GROUP BERHAD,GA1-15102020-00086,https://disclosure.bursamalaysia.com/FileAccess/viewHtml/?e=3097060,General Announcement,OTHERS
"OTHERS MAH SING GROUP BERHAD (""MAH SING"" OR ""COMPANY"")
PROPOSED DIVERSIFICATION OF THE PRINCIPAL ACTIVITIES OF MAH SING TO INCLUDE MANUFACTURING AND TRADING OF GLOVES AND RELATED HEALTHCARE PRODUCTS (""GLOVES BUSINESS"") (""PROPOSED DIVERSIFICATION"")",16/10/2020,MAH SING GROUP BERHAD,GA1-16102020-00049,https://disclosure.bursamalaysia.com/FileAccess/viewHtml/?e=3097070,General Announcement,OTHERS
"TRANSACTIONS (CHAPTER 10 OF LISTING REQUIREMENTS) : NON RELATED PARTY TRANSACTIONS ECOFIRST CONSOLIDATED BHD (""ECB"" OR ""THE COMPANY"") - PROPOSED ACQUISITION BY ECOFIRST WORLDWIDE SDN BHD, A WHOLLY-OWNED SUBSIDIARY OF ECB, OF ALL THAT PIECE OF LEASEHOLD LAND MEASURING AN AREA APPROXIMATELY 19,243 SQUARE METRES HELD UNDER PN 115434 LOT 87187 (FORMERLY HELD UNDER H.S.(D) 260105 PT 23658) MUKIM BUKIT RAJA, DAERAH PETALING, NEGERI SELANGOR (""PROPOSED ACQUISITION"")
- ADDITIONAL INFORMATION",16/10/2020,ECOFIRST CONSOLIDATED BHD,GA1-16102020-00070,https://disclosure.bursamalaysia.com/FileAccess/viewHtml/?e=3097092,General Announcement,Transactions (Chapter 10 of Listing Requirements)
"NEW ISSUE OF SECURITIES (CHAPTER 6 OF LISTING REQUIREMENTS) : BONUS ISSUES HOMERITZ CORPORATION BERHAD (""HOMERITZ"" OR ""COMPANY"")
(I)	PROPOSED BONUS ISSUE OF SHARES; AND
(II)	PROPOSED FREE WARRANTS ISSUE
(COLLECTIVELY REFERRED TO AS THE ""PROPOSALS"")",16/10/2020,HOMERITZ CORPORATION BERHAD,GA1-16102020-00088,https://disclosure.bursamalaysia.com/FileAccess/viewHtml/?e=3097100,General Announcement,New Issue of Securities (Chapter 6 of listing requirements)
"NEW ISSUE OF SECURITIES (CHAPTER 6 OF LISTING REQUIREMENTS) : FUND RAISING QES GROUP BERHAD (""QES"" OR ""COMPANY"")
PROPOSED PRIVATE PLACEMENT OF UP TO 10% OF THE ISSUED ORDINARY SHARES IN QES",16/10/2020,QES GROUP BERHAD,GA1-14102020-00083,https://disclosure.bursamalaysia.com/FileAccess/viewHtml/?e=3097105,General Announcement,New Issue of Securities (Chapter 6 of listing requirements)
"NEW ISSUE OF SECURITIES (CHAPTER 6 OF LISTING REQUIREMENTS) : FUND RAISING ENCORP BERHAD (""ENCORP"" OR THE ""COMPANY"")
PRIVATE PLACEMENT OF UP TO 30,608,821 NEW ORDINARY SHARES IN ENCORP REPRESENTING UP TO 10% OF THE TOTAL NUMBER OF ISSUED SHARES OF ENCORP (EXCLUDING TREASURY SHARES) (""PLACEMENT"")",16/10/2020,ENCORP BERHAD,GA1-16102020-00027,https://disclosure.bursamalaysia.com/FileAccess/viewHtml/?e=3097107,General Announcement,New Issue of Securities (Chapter 6 of listing requirements)
"OTHERS APFT BERHAD (""APFT"" OR ""COMPANY"")
Delay in the Release of the Unaudited Quarterly Report for the period ended 31 July 2020 pursuant to
Paragraph 9.22(1) of the Main Market Listing Requirements of Bursa Malaysia Securities Berhad",16/10/2020,APFT BERHAD,GA1-16102020-00110,https://disclosure.bursamalaysia.com/FileAccess/viewHtml/?e=3097115,General Announcement,OTHERS
"OTHERS Reach Energy Berhad (""REB"" or the ""Company"") - Appointment of Interim Chief Executive Officer (""CEO"")",16/10/2020,REACH ENERGY BERHAD,GA1-14102020-00076,https://disclosure.bursamalaysia.com/FileAccess/viewHtml/?e=3097124,General Announcement,OTHERS
"OTHERS AWC BERHAD (""AWC"" OR ""THE COMPANY"")
-	LETTER OF APPOINTMENT (""LOA"") FROM PUTRAJAYA HOLDINGS SDN. BHD. (""PHSB"") TO AMBANG WIRA SDN. BHD. (""AWSB""), A WHOLLY-OWNED SUBSIDIARY OF THE COMPANY TO PROVIDE COMPREHENSIVE MANAGEMENT, MAINTENANCE AND OPERATIONAL SERVICES FOR COMMERCIAL OFFICE BUILDING AT GALERIA PJH, PRECINT 4, PUTRAJAYA",16/10/2020,AWC BERHAD,GA1-16102020-00064,https://disclosure.bursamalaysia.com/FileAccess/viewHtml/?e=3097129,General Announcement,OTHERS
ACME - Unusual Market Activity,16/10/2020,ACME HOLDINGS BERHAD,ILC-16102020-00009,https://disclosure.bursamalaysia.com/FileAccess/viewHtml/?e=3097131,Unusual Market Activity,UMA Query by Bursa
"NEW ISSUE OF SECURITIES (CHAPTER 6 OF LISTING REQUIREMENTS) : FUND RAISING SEDANIA INNOVATOR BERHAD (""SIB"" OR THE ""COMPANY"")
PRIVATE PLACEMENT OF UP TO 20% OF THE ISSUED SHARES IN SIB",16/10/2020,SEDANIA INNOVATOR BERHAD,GA1-16102020-00058,https://disclosure.bursamalaysia.com/FileAccess/viewHtml/?e=3097158,General Announcement,New Issue of Securities (Chapter 6 of listing requirements)
"MULTIPLE PROPOSALS ACO GROUP BERHAD (""ACO"" OR ""COMPANY"")
(I)	PROPOSED PRIVATE PLACEMENT; AND
(II)	PROPOSED ACQUISITION
COLLECTIVELY REFERRED TO AS ""PROPOSALS"".",16/10/2020,ACO GROUP BERHAD,GA1-16102020-00108,https://disclosure.bursamalaysia.com/FileAccess/viewHtml/?e=3097174,General Announcement,Multiple Proposals
"TRANSACTIONS (CHAPTER 10 OF LISTING REQUIREMENTS) : NON RELATED PARTY TRANSACTIONS LION INDUSTRIES CORPORATION BERHAD (""LICB"" OR THE ""COMPANY"")
Proposed disposal by Amsteel Mills Sdn Bhd (""AMSB"" or ""Seller""), a 99% owned subsidiary of the Company, of the hot-briquetted iron plant and business in Labuan by disposing of the entire 100% equity interest in Antara Steel Mills Sdn Bhd to Esteel Enterprise Pte Ltd (""Esteel"" or ""Buyer"") for a cash consideration of USD128.00 million (equivalent to RM546.56 million)",16/10/2020,LION INDUSTRIES CORPORATION BERHAD,GA1-15102020-00054,https://disclosure.bursamalaysia.com/FileAccess/viewHtml/?e=3097193,General Announcement,Transactions (Chapter 10 of Listing Requirements)
"OTHERS AGESON BERHAD (FORMERLY KNOWN AS PRINSIPTEK CORPORATION BERHAD) (""AGESON"" OR ""THE COMPANY"")
EXECUTION OF TERM SHEET BETWEEN AGESON ENTERPRISE SDN BHD (FORMERLY KNOWN AS ESA PILE SDN BHD), A WHOLLY-OWNED SUBSIDIARY OF THE COMPANY AND NAVIS MARINUS PRIVATE LIMITED TO SET UP A JOINT VENTURE COMPANY FOR THE SUPPLY AND DELIVERY OF SAND FROM PHILIPHINES TO JTC CORPORATION IN SINGAPORE (""PROPOSED COLLABORATION"") (""TERM SHEET"")",16/10/2020,AGESON BERHAD,GA1-16102020-00100,https://disclosure.bursamalaysia.com/FileAccess/viewHtml/?e=3097195,General Announcement,OTHERS
"OTHERS FOCUS DYNAMICS GROUP BERHAD (''FOCUS'' OR THE ''COMPANY'')
-Resignation of Auditors",16/10/2020,FOCUS DYNAMICS GROUP BERHAD,GA1-16102020-00044,https://disclosure.bursamalaysia.com/FileAccess/viewHtml/?e=3097196,General Announcement,OTHERS
"OTHERS AWC BERHAD (""AWC"" OR ""THE COMPANY"")
- PROPOSED AMENDMENTS TO THE CONSTITUTION OF THE COMPANY",16/10/2020,AWC BERHAD,GA1-16102020-00097,https://disclosure.bursamalaysia.com/FileAccess/viewHtml/?e=3097218,General Announcement,OTHERS
"OTHERS MTOUCHE TECHNOLOGY BERHAD (""MTOUCHE"" OR THE ""COMPANY"")
-	OFFER OF OPTIONS UNDER MTOUCHE EMPLOYEES' SHARE OPTIONS SCHEME (""MTOUCHE ESOS"")",16/10/2020,MTOUCHE TECHNOLOGY BERHAD,GA1-16102020-00096,https://disclosure.bursamalaysia.com/FileAccess/viewHtml/?e=3097229,General Announcement,OTHERS
"MULTIPLE PROPOSALS AMANAH HARTA TANAH PNB (""AHP"")
PROPOSED CONVERSION OF AHP TO AN UNLISTED REAL ESTATE INVESTMENT TRUST BY WAY OF:
(I)	PROPOSED SELECTIVE UNIT REDEMPTION EXERCISE; AND
(II)	PROPOSED AMENDMENTS TO THE FIRST RESTATED DEED OF AHP DATED 13 AUGUST 2015",16/10/2020,AMANAH HARTA TANAH PNB,GA1-16102020-00029,https://disclosure.bursamalaysia.com/FileAccess/viewHtml/?e=3097230,General Announcement,Multiple Proposals
"TRANSACTIONS (CHAPTER 10 OF LISTING REQUIREMENTS) : RELATED PARTY TRANSACTIONS ADDITIONAL INFORMATION TO THE ACQUISITION OF 510,002 ORDINARY SHARES IN NIAGA SARI SDN BHD FOR A TOTAL CASH CONSIDERATION OF RM12,000,000 ONLY",16/10/2020,HO HUP CONSTRUCTION COMPANY BHD,GA1-16102020-00020,https://disclosure.bursamalaysia.com/FileAccess/viewHtml/?e=3097269,General Announcement,Transactions (Chapter 10 of Listing Requirements)
"OTHERS PDZ HOLDINGS BHD. (""PDZH"" OR ""THE COMPANY"")
- Arrest of Vessel - PDZ Mewah
(Admiralti in Rem No.: WA-27NCC-8-01/2017)",16/10/2020,PDZ HOLDINGS BHD,GA1-16102020-00130,https://disclosure.bursamalaysia.com/FileAccess/viewHtml/?e=3097276,General Announcement,OTHERS
"OTHERS AXIATA GROUP BERHAD (""AXIATA"" OR ""COMPANY"")
PROPOSED LISTING OF ROBI AXIATA LIMITED (""ROBI""), A 68.69%-OWNED SUBSIDIARY OF AXIATA, ON THE DHAKA STOCK EXCHANGE LIMITED AND THE CHITTAGONG STOCK EXCHANGE LIMITED IN BANGLADESH (""PROPOSED LISTING"")",16/10/2020,AXIATA GROUP BERHAD,GA1-16102020-00037,https://disclosure.bursamalaysia.com/FileAccess/viewHtml/?e=3097277,General Announcement,OTHERS
"OTHERS HANDAL ENERGY BERHAD
- AWARD OF CONTRACT",19/10/2020,HANDAL ENERGY BERHAD,GA1-19102020-00016,https://disclosure.bursamalaysia.com/FileAccess/viewHtml/?e=3097302,General Announcement,OTHERS
"NEW ISSUE OF SECURITIES (CHAPTER 6 OF LISTING REQUIREMENTS) : BONUS ISSUES THONG GUAN INDUSTRIES BERHAD (""TGIB"" OR THE ""COMPANY"")
BONUS ISSUE OF UP TO 191,409,370 NEW ORDINARY SHARES IN TGIB (""TGIB SHARE(S)"" OR ""SHARE(S)"") (""BONUS SHARE(S)"") ON THE BASIS OF 1 BONUS SHARE FOR EVERY 1 EXISTING TGIB SHARE HELD ON AN ENTITLEMENT DATE TO BE DETERMINED LATER
(""BONUS ISSUE OF SHARES"")",19/10/2020,THONG GUAN INDUSTRIES BERHAD,GA1-19102020-00053,https://disclosure.bursamalaysia.com/FileAccess/viewHtml/?e=3097304,General Announcement,New Issue of Securities (Chapter 6 of listing requirements)
Letter Subject or Reference - UNUSUAL MARKET ACTIVITY,19/10/2020,ACME HOLDINGS BERHAD,GA1-19102020-00017,https://disclosure.bursamalaysia.com/FileAccess/viewHtml/?e=3097308,Unusual Market Activity,Reply to UMA Query
"NEW ISSUE OF SECURITIES (CHAPTER 6 OF LISTING REQUIREMENTS) : FUND RAISING EMICO HOLDINGS BERHAD (""EMICO"" OR ""COMPANY"")
PROPOSED PRIVATE PLACEMENT",19/10/2020,EMICO HOLDINGS BERHAD,GA1-18102020-00003,https://disclosure.bursamalaysia.com/FileAccess/viewHtml/?e=3097330,General Announcement,New Issue of Securities (Chapter 6 of listing requirements)
"OTHERS MALAYAN BANKING BERHAD (""MAYBANK"")
REDEMPTION OF SUBORDINATED NOTES OF RM2.2 BILLION IN NOMINAL VALUE (""RM2.2 BILLION SUBORDINATED NOTES"") ISSUED BY MAYBANK PURSUANT TO ITS SUBORDINATED NOTE PROGRAMME OF UP TO RM20.0 BILLION IN NOMINAL VALUE (INCREASED FROM RM7.0 BILLION IN NOMINAL VALUE) (""SUBORDINATED NOTE PROGRAMME"").",19/10/2020,MALAYAN BANKING BERHAD,GA1-19102020-00022,https://disclosure.bursamalaysia.com/FileAccess/viewHtml/?e=3097339,General Announcement,OTHERS
"OTHERS Allianz Malaysia Berhad (""Company"")
Decision by the Malaysia Competition Commission against the General Insurance Subsidiary of the Company",19/10/2020,ALLIANZ MALAYSIA BERHAD,GA1-19102020-00068,https://disclosure.bursamalaysia.com/FileAccess/viewHtml/?e=3097358,General Announcement,OTHERS
"OTHERS MAGNA PRIMA BERHAD (""MPB"")
MONTHLY ANNOUNCEMENT ON THE STATUS OF DEFAULT IN PAYMENT TO ALLIANCE BANK MALAYSIA BERHAD (""ALLIANCE BANK"") PURSUANT TO PARAGRAPH 9.19A OF THE MAIN MARKET LISTING REQUIREMENTS OF BURSA MALAYSIA SECURITIES BERHAD (""LISTING REQUIREMENTS"")",19/10/2020,MAGNA PRIMA BERHAD,GA1-19102020-00052,https://disclosure.bursamalaysia.com/FileAccess/viewHtml/?e=3097359,General Announcement,OTHERS
"NEW ISSUE OF SECURITIES (CHAPTER 6 OF LISTING REQUIREMENTS) : BONUS ISSUES SCIENTEX BERHAD (""SCIENTEX"" OR ""COMPANY"")
(I) PROPOSED BONUS ISSUE OF SHARES; AND
(II) PROPOSED ISSUE OF FREE WARRANTS
(COLLECTIVELY REFERRED TO AS THE ""PROPOSALS"")",19/10/2020,SCIENTEX BERHAD,GA1-16102020-00053,https://disclosure.bursamalaysia.com/FileAccess/viewHtml/?e=3097363,General Announcement,New Issue of Securities (Chapter 6 of listing requirements)
"OTHERS MELATI EHSAN HOLDINGS BERHAD
(""MEHB"" or ""THE COMPANY"")
- INCORPORATION OF A NEW SUBSIDIARY COMPANY",19/10/2020,MELATI EHSAN HOLDINGS BERHAD,GA1-16102020-00054,https://disclosure.bursamalaysia.com/FileAccess/viewHtml/?e=3097379,General Announcement,OTHERS
OTHERS Clarification on the article entitled FoundPac mulls spin-off listing of laser stencil business,19/10/2020,FOUNDPAC GROUP BERHAD,GA1-19102020-00069,https://disclosure.bursamalaysia.com/FileAccess/viewHtml/?e=3097392,General Announcement,OTHERS
"OTHERS PRESTARIANG BERHAD ("" PRESTARIANG"" OR ""THE COMPANY"") - PROPOSED RENEWAL OF AUTHORITY FOR THE COMPANY TO PURCHASE ITS OWN SHARES OF UP TO 10% OF THE TOTAL NUMBER OF ISSUED SHARES OF THE COMPANY (""PROPOSED RENEWAL OF SHARE BUY-BACK AUTHORITY"")",19/10/2020,PRESTARIANG BERHAD,GA1-15102020-00023,https://disclosure.bursamalaysia.com/FileAccess/viewHtml/?e=3097400,General Announcement,OTHERS
OTHERS DEVELOPMENT ON THE NOTICE OF ADDITIONAL ASSESSMENT FOR THE YEAR OF ASSESSMENT 2018 RECEIVED FROM INLAND REVENUE BOARD OF MALAYSIA,19/10/2020,TENAGA NASIONAL BHD,GA1-19102020-00064,https://disclosure.bursamalaysia.com/FileAccess/viewHtml/?e=3097408,General Announcement,OTHERS
"OTHERS WAH SEONG CORPORATION BERHAD (""WSC"" OR ""COMPANY"")
- PROPOSED DISPOSAL OF 70% ORDINARY SHAREHOLDINGS IN SPIROLITE (M) SENDIRIAN BERHAD TO LESSO MALAYSIA HOLDINGS SDN. BHD. BY SYN TAI HUNG TRADING SDN. BHD., AN INDIRECT WHOLLY-OWNED SUBSIDIARY OF THE COMPANY",19/10/2020,WAH SEONG CORPORATION BERHAD,GA1-19102020-00078,https://disclosure.bursamalaysia.com/FileAccess/viewHtml/?e=3097445,General Announcement,OTHERS
"OTHERS PLB ENGINEERING BERHAD (PLB OR THE COMPANY)
PROPOSED JOINT DEVELOPMENT BETWEEN THE GOVERNMENT OF THE STATE OF PENANG (PENANG STATE GOVERNMENT), THE PENANG DEVELOPMENT CORPORATION (PDC) AND PLB TO UNDERTAKE THE REHABILITATION WORKS, CONSTRUCTION AND OPERATION OF A NEW INTEGRATED RECYCLING CENTRE AND DEVELOPMENT ON PLBS ENTITLED LAND",19/10/2020,PLB ENGINEERING BERHAD,GA1-19102020-00084,https://disclosure.bursamalaysia.com/FileAccess/viewHtml/?e=3097453,General Announcement,OTHERS
"OTHERS XOX BHD
- Offer and Grant of Options under Share Issuance Scheme (""SIS"")",19/10/2020,XOX BHD,GA1-19102020-00082,https://disclosure.bursamalaysia.com/FileAccess/viewHtml/?e=3097463,General Announcement,OTHERS
"OTHERS AT SYSTEMATIZATION BERHAD (""AT"" OR ""THE COMPANY"")
- OFFER OF OPTIONS UNDER SHARE ISSUANCE SCHEME (""SIS"")",19/10/2020,AT SYSTEMATIZATION BERHAD,GA1-19102020-00081,https://disclosure.bursamalaysia.com/FileAccess/viewHtml/?e=3097466,General Announcement,OTHERS
"NEW ISSUE OF SECURITIES (CHAPTER 6 OF LISTING REQUIREMENTS) : FUND RAISING BINTAI KINDEN CORPORATION BERHAD (""BKCB"" OR ""COMPANY"")
PROPOSED PRIVATE PLACEMENT OF UP TO 10% OF THE ISSUED ORDINARY SHARES IN BKCB",19/10/2020,BINTAI KINDEN CORPORATION BERHAD,GA1-19102020-00085,https://disclosure.bursamalaysia.com/FileAccess/viewHtml/?e=3097488,General Announcement,New Issue of Securities (Chapter 6 of listing requirements)
"OTHERS AGESON BERHAD (FORMERLY KNOWN AS PRINSIPTEK CORPORATION BERHAD) (""AGESON"" OR ""THE COMPANY"")
EXECUTION OF TERM SHEET BETWEEN AGESON ENTERPRISE SDN BHD (FORMERLY KNOWN AS ESA PILE SDN BHD), A WHOLLY-OWNED SUBSIDIARY OF THE COMPANY AND NAVIS MARINUS PRIVATE LIMITED TO SET UP A JOINT VENTURE COMPANY FOR THE SUPPLY AND DELIVERY OF SAND FROM PHILIPHINES TO JTC CORPORATION IN SINGAPORE (""PROPOSED COLLABORATION"") (""TERM SHEET"")",19/10/2020,AGESON BERHAD,GA1-19102020-00086,https://disclosure.bursamalaysia.com/FileAccess/viewHtml/?e=3097489,General Announcement,OTHERS
"TRANSACTIONS (CHAPTER 10 OF LISTING REQUIREMENTS) : NON RELATED PARTY TRANSACTIONS MMAG HOLDINGS BERHAD (""MMAG"" OR ""THE COMPANY"")
ACQUISITION BY MGUDANG SDN. BHD. (A WHOLLY-OWNED SUBSIDIARY OF MMAG) OF 2 PARCELS OF CONTIGUOUS FREEHOLD LAND TOGETHER WITH ALL BUILDINGS ERECTED THEREON FOR A TOTAL CASH CONSIDERATION OF RM41.0 MILLION (""ACQUISITION"")",19/10/2020,MMAG HOLDINGS BERHAD,GA1-19102020-00050,https://disclosure.bursamalaysia.com/FileAccess/viewHtml/?e=3097490,General Announcement,Transactions (Chapter 10 of Listing Requirements)
"TRANSACTIONS (CHAPTER 10 OF LISTING REQUIREMENTS) : RECURRENT RELATED PARTY TRANSACTIONS MACPIE BERHAD (""MACPIE"" OR ""THE COMPANY"")
PROPOSED NEW AND RENEWAL OF SHAREHOLDERS' MANDATE FOR RECURRENT RELATED PARTY TRANSACTIONS OF A REVENUE OR TRADING NATURE (""PROPOSED SHAREHOLDERS' MANDATE"")",19/10/2020,MACPIE BERHAD,GA1-16102020-00056,https://disclosure.bursamalaysia.com/FileAccess/viewHtml/?e=3097513,General Announcement,Transactions (Chapter 10 of Listing Requirements)
"OTHERS SCOMI GROUP BHD (""SGB"" OR ""THE COMPANY"")
- MONTHLY ANNOUNCEMENT ON THE STATUS OF DEFAULT IN PAYMENT TO AXIS BANK LIMITED PURSUANT TO PARAGRAPH 9.19A OF THE
BURSA MALAYSIA SECURITIES BERHAD'S MAIN MARKET LISTING REQUIREMENTS",19/10/2020,SCOMI GROUP BERHAD,GA1-16102020-00055,https://disclosure.bursamalaysia.com/FileAccess/viewHtml/?e=3097530,General Announcement,OTHERS
"TRANSACTIONS (CHAPTER 10 OF LISTING REQUIREMENTS) : RELATED PARTY TRANSACTIONS CESSATION AS INDIRECT SUBSTANTIAL SHAREHOLDER
- TAN SRI DATO' KAMALUDDIN BIN ABDULLAH",19/10/2020,SCOMI GROUP BERHAD,GA1-19102020-00096,https://disclosure.bursamalaysia.com/FileAccess/viewHtml/?e=3097532,General Announcement,Transactions (Chapter 10 of Listing Requirements)
"OTHERS VSOLAR GROUP BERHAD (THE ""COMPANY"" or ""VSOLAR"")
- EMPLOYEES SHARE OPTION SCHEME (""ESOS"")",19/10/2020,VSOLAR GROUP BERHAD,GA1-06102020-00108,https://disclosure.bursamalaysia.com/FileAccess/viewHtml/?e=3097544,General Announcement,OTHERS
"NEW ISSUE OF SECURITIES (CHAPTER 6 OF LISTING REQUIREMENTS) : BONUS ISSUES XOX BHD (""XOX"" OR THE ""COMPANY"")
PROPOSED BONUS ISSUE OF WARRANTS",19/10/2020,XOX BHD,GA1-19102020-00115,https://disclosure.bursamalaysia.com/FileAccess/viewHtml/?e=3097554,General Announcement,New Issue of Securities (Chapter 6 of listing requirements)
"OTHERS PESTECH INTERNATIONAL BERHAD (PIB OR COMPANY)
-	NOTIFICATION ON CHANGE IN THE INTEREST OF DIRECTOR AND SUBSTANTIAL SHAREHOLDER, LIM PAY CHUAN",19/10/2020,PESTECH INTERNATIONAL BERHAD,GA1-19102020-00046,https://disclosure.bursamalaysia.com/FileAccess/viewHtml/?e=3097566,General Announcement,OTHERS
"NEW ISSUE OF SECURITIES (CHAPTER 6 OF LISTING REQUIREMENTS) : FUND RAISING FOCUS DYNAMICS GROUP BERHAD (''FOCUS'' OR THE ''COMPANY'')
RIGHTS ISSUE OF ICPS WITH WARRANTS",19/10/2020,FOCUS DYNAMICS GROUP BERHAD,GA1-19102020-00113,https://disclosure.bursamalaysia.com/FileAccess/viewHtml/?e=3097573,General Announcement,New Issue of Securities (Chapter 6 of listing requirements)
"NEW ISSUE OF SECURITIES (CHAPTER 6 OF LISTING REQUIREMENTS) : BONUS ISSUES EURO HOLDINGS BERHAD (""EURO"" OR THE ""COMPANY"")
PROPOSED BONUS ISSUE",20/10/2020,EURO HOLDINGS BERHAD,GA1-20102020-00014,https://disclosure.bursamalaysia.com/FileAccess/viewHtml/?e=3097674,General Announcement,New Issue of Securities (Chapter 6 of listing requirements)
"NEW ISSUE OF SECURITIES (CHAPTER 6 OF LISTING REQUIREMENTS) : FUND RAISING JAG BERHAD (""JAG"" OR THE ""COMPANY"")
PROPOSED PRIVATE PLACEMENT OF UP TO 20% OF THE TOTAL NUMBER OF ISSUED SHARES IN JAG (""PROPOSED PRIVATE PLACEMENT"")",20/10/2020,JAG BERHAD,GA1-19102020-00024,https://disclosure.bursamalaysia.com/FileAccess/viewHtml/?e=3097678,General Announcement,New Issue of Securities (Chapter 6 of listing requirements)
"NEW ISSUE OF SECURITIES (CHAPTER 6 OF LISTING REQUIREMENTS) : FUND RAISING NWP HOLDINGS BERHAD (""NWP"")
PROPOSED PRIVATE PLACEMENT",20/10/2020,NWP HOLDINGS BERHAD,GA1-19102020-00100,https://disclosure.bursamalaysia.com/FileAccess/viewHtml/?e=3097679,General Announcement,New Issue of Securities (Chapter 6 of listing requirements)
"NEW ISSUE OF SECURITIES (CHAPTER 6 OF LISTING REQUIREMENTS) : BONUS ISSUES THONG GUAN INDUSTRIES BERHAD (""TGIB"" OR THE ""COMPANY"")
BONUS ISSUE OF UP TO 191,409,370 NEW ORDINARY SHARES IN TGIB (""TGIB SHARE(S)"" OR ""SHARE(S)"") (""BONUS SHARE(S)"") ON THE BASIS OF 1 BONUS SHARE FOR EVERY 1 EXISTING TGIB SHARE HELD ON AN ENTITLEMENT DATE TO BE DETERMINED LATER
(""BONUS ISSUE OF SHARES"")",20/10/2020,THONG GUAN INDUSTRIES BERHAD,GA1-20102020-00038,https://disclosure.bursamalaysia.com/FileAccess/viewHtml/?e=3097681,General Announcement,New Issue of Securities (Chapter 6 of listing requirements)
"NEW ISSUE OF SECURITIES (CHAPTER 6 OF LISTING REQUIREMENTS) : FUND RAISING AMTEL HOLDINGS BERHAD (""AHB"" OR THE ""COMPANY"")
PRIVATE PLACEMENT OF UP TO 20% OF THE TOTAL NUMBER OF ISSUED SHARES OF AHB (EXCLUDING TREASURY SHARES) (""PRIVATE PLACEMENT"")",20/10/2020,AMTEL HOLDINGS BERHAD,GA1-20102020-00040,https://disclosure.bursamalaysia.com/FileAccess/viewHtml/?e=3097684,General Announcement,New Issue of Securities (Chapter 6 of listing requirements)
GETS - Unusual Market Activity,20/10/2020,GETS GLOBAL BERHAD,ILC-20102020-00003,https://disclosure.bursamalaysia.com/FileAccess/viewHtml/?e=3097700,Unusual Market Activity,UMA Query by Bursa
"OTHERS JHM CONSOLIDATION BERHAD (""JHM"" OR ""COMPANY"")
PROPOSED TRANSFER",20/10/2020,JHM CONSOLIDATION BERHAD,GA1-20102020-00001,https://disclosure.bursamalaysia.com/FileAccess/viewHtml/?e=3097711,General Announcement,OTHERS
"MULTIPLE PROPOSALS Proposed Renewal of Shareholders Mandate for Recurrent Related Party
Transactions, Authority to Allot Shares Pursuant to Section 75 and Section 76
of the Companies Act 2016 and Proposed Renewal of Authority for the
Company to Purchase Its Own Shares.",20/10/2020,BINA PURI HOLDINGS BHD,GA1-20102020-00054,https://disclosure.bursamalaysia.com/FileAccess/viewHtml/?e=3097725,General Announcement,Multiple Proposals
"MULTIPLE PROPOSALS VORTEX CONSOLIDATED BERHAD (""VORTEX"" OR THE ""COMPANY"")
(I)	PROPOSED PRIVATE PLACEMENT;
(II)	PROPOSED SHARE CONSOLIDATION;
(III)	PROPOSED RIGHTS ISSUE; AND
(IV)	PROPOSED AMENDMENT.",20/10/2020,VORTEX CONSOLIDATED BERHAD,GA1-19102020-00120,https://disclosure.bursamalaysia.com/FileAccess/viewHtml/?e=3097760,General Announcement,Multiple Proposals
"OTHERS TASCO Berhad (""TASCO"" or ""Company"")
Clarification on article titled ""Inter-Pacific 'Neutral' on TASCO's potential vaccine contract"" which appeared in the Malaysian Reserve on 14 September 2020.",20/10/2020,TASCO BERHAD,GA1-20102020-00065,https://disclosure.bursamalaysia.com/FileAccess/viewHtml/?e=3097777,General Announcement,OTHERS
"TRANSACTIONS (CHAPTER 10 OF LISTING REQUIREMENTS) : NON RELATED PARTY TRANSACTIONS KEY ALLIANCE GROUP BERHAD (""KAG"" or ""the Company"")
ACQUISITON OF SHARES IN XOX BERHAD (""XOX"")(""INVESTMENT"")",20/10/2020,KEY ALLIANCE GROUP BERHAD,GA1-20102020-00090,https://disclosure.bursamalaysia.com/FileAccess/viewHtml/?e=3097780,General Announcement,Transactions (Chapter 10 of Listing Requirements)
"NEW ISSUE OF SECURITIES (CHAPTER 6 OF LISTING REQUIREMENTS) : FUND RAISING SALCON BERHAD (""SALCON"" OR THE ""COMPANY"")
PRIVATE PLACEMENT OF UP TO 20% OF THE TOTAL NUMBER OF ISSUED SHARES (EXCLUDING TREASURY SHARES) OF SALCON (""PRIVATE PLACEMENT"")",20/10/2020,SALCON BERHAD,GA1-20102020-00019,https://disclosure.bursamalaysia.com/FileAccess/viewHtml/?e=3097781,General Announcement,New Issue of Securities (Chapter 6 of listing requirements)
"OTHERS YI-LAI BERHAD (''YI-LAI'' OR THE ''COMPANY'')
CHANGE OF AUDITORS",20/10/2020,YI-LAI BERHAD,GA1-20102020-00033,https://disclosure.bursamalaysia.com/FileAccess/viewHtml/?e=3097790,General Announcement,OTHERS
"OTHERS KHEE SAN BERHAD (""KSB"" OR ""COMPANY"")
- APPOINTMENT OF BDO GOVERNANCE ADVISORY SDN BHD (""BDOGA"")",20/10/2020,KHEE SAN BERHAD,GA1-20102020-00085,https://disclosure.bursamalaysia.com/FileAccess/viewHtml/?e=3097791,General Announcement,OTHERS
"OTHERS INIX TECHNOLOGIES HOLDINGS BERHAD (""the Company"" or ""INIX"")
- Offer of Options under Share Issuance Scheme (""SIS"")",20/10/2020,INIX TECHNOLOGIES HOLDINGS BERHAD,GA1-20102020-00066,https://disclosure.bursamalaysia.com/FileAccess/viewHtml/?e=3097792,General Announcement,OTHERS
"OTHERS EMICO HOLDINGS BERHAD (""EMICO"" OR THE ""COMPANY"")
- Share Options under the Employees Share Option Scheme (""ESOS"")",20/10/2020,EMICO HOLDINGS BERHAD,GA1-20102020-00010,https://disclosure.bursamalaysia.com/FileAccess/viewHtml/?e=3097796,General Announcement,OTHERS
