title,date_announced,company_name,reference_number,url,assigned_category,sub_category
"MULTIPLE PROPOSALS DOLPHIN INTERNATIONAL BERHAD (""DOLPHIN"")
(I)	RIGHTS ISSUE;
(II)	CAPITALISATION; AND
(III)	ACQUISITION
(COLLECTIVELY THE ""CORPORATE EXERCISES"")",1/10/2020,DOLPHIN INTERNATIONAL BERHAD,GA1-01102020-00055,https://disclosure.bursamalaysia.com/FileAccess/viewHtml/?e=3092860,General Announcement,Multiple Proposals
PRACTICE NOTE 17 / GUIDANCE NOTE 3 : MONTHLY ANNOUNCEMENT,1/10/2020,EKA NOODLES BERHAD,GA1-01102020-00109,https://disclosure.bursamalaysia.com/FileAccess/viewHtml/?e=3092862,General Announcement,Practice Note 17 / Guidance Note 3
"TRANSACTIONS (CHAPTER 10 OF LISTING REQUIREMENTS) : RELATED PARTY TRANSACTIONS PROTASCO BERHAD (""PROTASCO"" OR THE ""COMPANY"")
JOINT DEVELOPMENT BETWEEN DE CENTRUM RETAIL SDN BHD (NOW KNOWN AS DC RESORT HOMES SDN BHD) (""DCRSB""), AN INDIRECT WHOLLY-OWNED SUBSIDIARY OF PROTASCO, AND PENMALAND SDN BHD (""PENMALAND"") TO JOINTLY DEVELOP THREE (3) CONTIGUOUS PARCELS OF FREEHOLD DEVELOPMENT LAND IN MUKIM OF TAMPIN TENGAH, DISTRICT OF TAMPIN, NEGERI SEMBILAN DARUL KHUSUS (""TAMPIN LAND"") (""JOINT DEVELOPMENT"")",1/10/2020,PROTASCO BERHAD,GA1-01102020-00108,https://disclosure.bursamalaysia.com/FileAccess/viewHtml/?e=3092884,General Announcement,Transactions (Chapter 10 of Listing Requirements)
Shareholder agreement between Key Alliance Group Berhad (KAG) and Rimbunan Daun Ventures Sdn Bhd (RDV) and Fortifoods Sdn Bhd (Forti),1/10/2020,KEY ALLIANCE GROUP BERHAD,GA1-01102020-00083,https://disclosure.bursamalaysia.com/FileAccess/viewHtml/?e=3092887,Reply to Query,-
PRACTICE NOTE 17 / GUIDANCE NOTE 3 : MONTHLY ANNOUNCEMENT,1/10/2020,WINTONI GROUP BERHAD,GA1-01102020-00079,https://disclosure.bursamalaysia.com/FileAccess/viewHtml/?e=3092888,General Announcement,Practice Note 17 / Guidance Note 3
PRACTICE NOTE 17 / GUIDANCE NOTE 3 : MONTHLY ANNOUNCEMENT,1/10/2020,KINSTEEL BHD,GA1-01102020-00116,https://disclosure.bursamalaysia.com/FileAccess/viewHtml/?e=3092899,General Announcement,Practice Note 17 / Guidance Note 3
"Notice to commence arbitration proceedings by Salcon MMCB AZSB JV Sdn Bhd (""SMAJV"") against Pengurusan Aset Air Berhad (""PAAB"")",1/10/2020,MMC CORPORATION BERHAD,GA1-01102020-00085,https://disclosure.bursamalaysia.com/FileAccess/viewHtml/?e=3092903,Reply to Query,-
OTHERS Quarterly Financial Report pursuant to Paragraph 9.22 of the Main Market Listing Requirements of Bursa Malaysia Securities Berhad,1/10/2020,BURSA MALAYSIA BERHAD,GA1-14072020-00089,https://disclosure.bursamalaysia.com/FileAccess/viewHtml/?e=3092910,General Announcement,OTHERS
"NEW ISSUE OF SECURITIES (CHAPTER 6 OF LISTING REQUIREMENTS) : FUND RAISING DESTINI BERHAD (""DESTINI"" OR THE ""COMPANY"")
PROPOSED PRIVATE PLACEMENT OF UP TO 20% OF THE TOTAL NUMBER OF ISSUED SHARES OF DESTINI (EXCLUDING TREASURY SHARES) (""PROPOSED PRIVATE PLACEMENT"")",1/10/2020,DESTINI BERHAD,GA1-01102020-00114,https://disclosure.bursamalaysia.com/FileAccess/viewHtml/?e=3092921,General Announcement,New Issue of Securities (Chapter 6 of listing requirements)
PRACTICE NOTE 17 / GUIDANCE NOTE 3 : MONTHLY ANNOUNCEMENT,1/10/2020,BRAHIM'S HOLDINGS BERHAD,GA1-01102020-00117,https://disclosure.bursamalaysia.com/FileAccess/viewHtml/?e=3092923,General Announcement,Practice Note 17 / Guidance Note 3
"OTHERS Aemulus Holdings Berhad (""Aemulus"" or ""the Company"")
- Award of ordinary shares of the Company (""RSP Shares"") under the Aemulus Holdings Berhad Restricted Share Plan (""RSP"")",1/10/2020,AEMULUS HOLDINGS BERHAD,GA1-25092020-00061,https://disclosure.bursamalaysia.com/FileAccess/viewHtml/?e=3092928,General Announcement,OTHERS
"NEW ISSUE OF SECURITIES (CHAPTER 6 OF LISTING REQUIREMENTS) : FUND RAISING ONLY WORLD GROUP HOLDINGS BERHAD (""OWG"" OR ""COMPANY"") - RENOUNCEABLE RIGHTS ISSUE OF UP TO 160,259,996 NEW ORDINARY SHARES IN OWG (""OWG SHARE(S)"") (""RIGHTS SHARE(S)"") TOGETHER WITH UP TO 80,129,998 FREE DETACHABLE WARRANTS IN OWG (""WARRANTS B"") ON THE BASIS OF 2 RIGHTS SHARES TOGETHER WITH 1 FREE WARRANT B FOR EVERY 5 EXISTING OWG SHARES HELD BY THE SHAREHOLDERS OF THE COMPANY ON AN ENTITLEMENT DATE TO BE DETERMINED AND ANNOUNCED LATER (""RIGHTS ISSUE WITH WARRANTS"")",1/10/2020,ONLY WORLD GROUP HOLDINGS BERHAD,GA1-30092020-00104,https://disclosure.bursamalaysia.com/FileAccess/viewHtml/?e=3092933,General Announcement,New Issue of Securities (Chapter 6 of listing requirements)
PRACTICE NOTE 17 / GUIDANCE NOTE 3 : MONTHLY ANNOUNCEMENT,1/10/2020,IDIMENSION CONSOLIDATED BHD,GA1-29092020-00016,https://disclosure.bursamalaysia.com/FileAccess/viewHtml/?e=3092936,General Announcement,Practice Note 17 / Guidance Note 3
PRACTICE NOTE 17 / GUIDANCE NOTE 3 : MONTHLY ANNOUNCEMENT,1/10/2020,MALAYSIA PACIFIC CORPORATION BERHAD,GA1-01102020-00029,https://disclosure.bursamalaysia.com/FileAccess/viewHtml/?e=3092938,General Announcement,Practice Note 17 / Guidance Note 3
"OTHERS TA GLOBAL BERHAD (TAG OR THE COMPANY)
-	RESUMPTION OF BUSINESS",1/10/2020,TA GLOBAL BERHAD,GA1-01102020-00118,https://disclosure.bursamalaysia.com/FileAccess/viewHtml/?e=3092954,General Announcement,OTHERS
PRACTICE NOTE 17 / GUIDANCE NOTE 3 : MONTHLY ANNOUNCEMENT,1/10/2020,TH HEAVY ENGINEERING BERHAD,GA1-01102020-00081,https://disclosure.bursamalaysia.com/FileAccess/viewHtml/?e=3092958,General Announcement,Practice Note 17 / Guidance Note 3
PRACTICE NOTE 17 / GUIDANCE NOTE 3 : MONTHLY ANNOUNCEMENT,1/10/2020,SCOMI GROUP BERHAD,GA1-30092020-00013,https://disclosure.bursamalaysia.com/FileAccess/viewHtml/?e=3092959,General Announcement,Practice Note 17 / Guidance Note 3
"OTHERS KARYON INDUSTRIES BERHAD (""KIB"" OR ""COMPANY"")
- LETTER FROM JABATAN KASTAM DIRAJA MALAYSIA",1/10/2020,KARYON INDUSTRIES BERHAD,GA1-18092020-00102,https://disclosure.bursamalaysia.com/FileAccess/viewHtml/?e=3092962,General Announcement,OTHERS
"OTHERS TENAGA NASIONAL BERHAD (""TNB"" OR ""COMPANY"")
PROPOSED INTERNAL REORGANISATION BY WAY OF A MEMBERS' SCHEME OF ARRANGEMENT UNDER SECTION 366 OF THE COMPANIES ACT, 2016 (""PROPOSED INTERNAL REORGANISATION"")",1/10/2020,TENAGA NASIONAL BHD,GA1-01102020-00074,https://disclosure.bursamalaysia.com/FileAccess/viewHtml/?e=3092964,General Announcement,OTHERS
"OTHERS Delay in the Release of the Unaudited Quarterly Report for the period ended 31 July 2020 pursuant to
Paragraph 9.22(1) of the Main Market Listing Requirements of Bursa Malaysia Securities Berhad",1/10/2020,APFT BERHAD,GA1-01102020-00097,https://disclosure.bursamalaysia.com/FileAccess/viewHtml/?e=3092965,General Announcement,OTHERS
PRACTICE NOTE 17 / GUIDANCE NOTE 3 : MONTHLY ANNOUNCEMENT,1/10/2020,APFT BERHAD,GA1-01102020-00089,https://disclosure.bursamalaysia.com/FileAccess/viewHtml/?e=3092966,General Announcement,Practice Note 17 / Guidance Note 3
PRACTICE NOTE 17 / GUIDANCE NOTE 3 : MONTHLY ANNOUNCEMENT,1/10/2020,G NEPTUNE BERHAD,GA1-25092020-00026,https://disclosure.bursamalaysia.com/FileAccess/viewHtml/?e=3092973,General Announcement,Practice Note 17 / Guidance Note 3
"OTHERS G NEPTUNE BERHAD (""GNB"" OR ""THE COMPANY"")
MONTHLY ANNOUNCEMENT ON THE STATUS OF DEFAULT IN PAYMENT PURSUANT TO RULE 9.19A OF BURSA MALAYSIA SECURITIES
BERHAD'S ACE MARKET LISTING REQUIREMENTS (""LISTING REQUIREMENTS"")",1/10/2020,G NEPTUNE BERHAD,GA1-25092020-00025,https://disclosure.bursamalaysia.com/FileAccess/viewHtml/?e=3092974,General Announcement,OTHERS
"NEW ISSUE OF SECURITIES (CHAPTER 6 OF LISTING REQUIREMENTS) : FUND RAISING XIN HWA HOLDINGS BERHAD (""XHH"" OR ""COMPANY"")
PRIVATE PLACEMENT OF UP TO 21,599,999 NEW ORDINARY SHARES IN XHH (""SHARE(S)"") (""PLACEMENT SHARE(S)""), REPRESENTING UP TO 10% OF THE TOTAL NUMBER OF ISSUED SHARES OF XHH (""PRIVATE PLACEMENT"")",1/10/2020,XIN HWA HOLDINGS BERHAD,GA1-01102020-00086,https://disclosure.bursamalaysia.com/FileAccess/viewHtml/?e=3092982,General Announcement,New Issue of Securities (Chapter 6 of listing requirements)
PRACTICE NOTE 17 / GUIDANCE NOTE 3 : MONTHLY ANNOUNCEMENT,1/10/2020,IQZAN HOLDING BERHAD,GA1-28092020-00047,https://disclosure.bursamalaysia.com/FileAccess/viewHtml/?e=3092988,General Announcement,Practice Note 17 / Guidance Note 3
"OTHERS KHEE SAN BERHAD (""THE COMPANY"" OR ""KSB"")
MONTHLY ANNOUNCEMENT ON THE STATUS OF DEFAULT IN PAYMENT PURSUANT TO PARAGRAPH 9.19A OF THE BURSA MALAYSIA SECURITIES BERHAD MAIN MARKET LISTING REQUIREMENTS (""MMLR"")",1/10/2020,KHEE SAN BERHAD,GA1-01102020-00123,https://disclosure.bursamalaysia.com/FileAccess/viewHtml/?e=3092997,General Announcement,OTHERS
"OTHERS SEACERA GROUP BERHAD (""SEACERA"" OR ""THE COMPANY"")
- MONTHLY ANNOUNCEMENT ON THE STATUS OF DEFAULT IN PAYMENT PURSUANT TO PARAGRAPH 9.19A OF THE MAIN MARKET LISTING REQUIREMENTS OF BURSA MALAYSIA SECURITIES BERHAD",1/10/2020,SEACERA GROUP BERHAD,GA1-01102020-00061,https://disclosure.bursamalaysia.com/FileAccess/viewHtml/?e=3092998,General Announcement,OTHERS
PRACTICE NOTE 17 / GUIDANCE NOTE 3 : MONTHLY ANNOUNCEMENT,1/10/2020,SEACERA GROUP BERHAD,GA1-01102020-00060,https://disclosure.bursamalaysia.com/FileAccess/viewHtml/?e=3093001,General Announcement,Practice Note 17 / Guidance Note 3
"TRANSACTIONS (CHAPTER 10 OF LISTING REQUIREMENTS) : NON RELATED PARTY TRANSACTIONS REVENUE GROUP BERHAD (""REVENUE"" OR ""COMPANY"")
-	ACQUISITION OF 40% EQUITY INTEREST IN WANNATALK MALAYSIA SDN. BHD. (""WMSB"") FOR A PURCHASE CONSIDERATION OF RM5,000,000.00 BY REVENUE HARVEST SDN. BHD. (""RHSB""), A WHOLLY-OWNED SUBSIDIARY OF REVENUE",1/10/2020,REVENUE GROUP BERHAD,GA1-01102020-00053,https://disclosure.bursamalaysia.com/FileAccess/viewHtml/?e=3093005,General Announcement,Transactions (Chapter 10 of Listing Requirements)
PRACTICE NOTE 17 / GUIDANCE NOTE 3 : MONTHLY ANNOUNCEMENT,1/10/2020,PERAK CORPORATION BERHAD,GA1-01102020-00069,https://disclosure.bursamalaysia.com/FileAccess/viewHtml/?e=3093009,General Announcement,Practice Note 17 / Guidance Note 3
"OTHERS KOSSAN RUBBER INDUSTRIES BHD. (""KOSSAN"" OR ""COMPANY"") REMEDIATION PAYMENT TO MIGRANT WORKERS",1/10/2020,KOSSAN RUBBER INDUSTRIES BERHAD,GA1-01102020-00087,https://disclosure.bursamalaysia.com/FileAccess/viewHtml/?e=3093011,General Announcement,OTHERS
"OTHERS KINSTEEL BHD (IN LIQUIDATION) (""KINSTEEL"" OR ""THE COMPANY"")
DEBT RESTRUCTURING AGREEMENT (""DRA"") FOR THE PROPOSED RESTRUCTURING AND SETTLEMENT OF DEBTS OWING TO THE CREDITORS OF THE COMPANY AND ITS 51%-OWNED SUBSIDIARY, PERFECT CHANNEL SDN BHD (""PCSB"")",1/10/2020,KINSTEEL BHD,GA1-01102020-00036,https://disclosure.bursamalaysia.com/FileAccess/viewHtml/?e=3093014,General Announcement,OTHERS
"NEW ISSUE OF SECURITIES (CHAPTER 6 OF LISTING REQUIREMENTS) : FUND RAISING LFE CORPORATION BERHAD (""LFE"" OR THE ""COMPANY"")
PRIVATE PLACEMENT OF UP TO 20% OF THE TOTAL NUMBER OF ISSUED SHARES OF LFE (""PRIVATE PLACEMENT"")",1/10/2020,LFE CORPORATION BERHAD,GA1-01102020-00119,https://disclosure.bursamalaysia.com/FileAccess/viewHtml/?e=3093025,General Announcement,New Issue of Securities (Chapter 6 of listing requirements)
PRACTICE NOTE 17 / GUIDANCE NOTE 3 : MONTHLY ANNOUNCEMENT,1/10/2020,BARAKAH OFFSHORE PETROLEUM BERHAD,GA1-01092020-00108,https://disclosure.bursamalaysia.com/FileAccess/viewHtml/?e=3093027,General Announcement,Practice Note 17 / Guidance Note 3
"OTHERS BARAKAH OFFSHORE PETROLEUM BERHAD (""BARAKAH"" OR THE ""COMPANY"")
- DEFAULT IN PAYMENT PURSUANT TO PARAGRAPH 9.19A OF THE MAIN MARKET LISTING REQUIREMENTS OF BURSA MALAYSIA SECURITIES BERHAD (""BURSA SECURITIES"") (""LISTING REQUIREMENTS"") (""DEFAULT IN PAYMENT"")",1/10/2020,BARAKAH OFFSHORE PETROLEUM BERHAD,GA1-01092020-00109,https://disclosure.bursamalaysia.com/FileAccess/viewHtml/?e=3093028,General Announcement,OTHERS
"OTHERS AGESON BERHAD (FORMERLY KNOWN AS PRINSIPTEK CORPORATION BERHAD)
(""AGESON"" OR ""THE COMPANY"")
MONTHLY ANNOUNCEMENT ON THE STATUS UPDATE ON THE DEFAULT IN PAYMENT PURSUANT TO PARAGRAPH 9.19A OF THE MAIN MARKET LISTING REQUIREMENTS OF BURSA MALAYSIA SECURITIES BERHAD (DEFAULT IN PAYMENT)",1/10/2020,AGESON BERHAD,GA1-01102020-00037,https://disclosure.bursamalaysia.com/FileAccess/viewHtml/?e=3093045,General Announcement,OTHERS
"OTHERS INTA BINA GROUP BERHAD (""INTA BINA"" OR ""THE COMPANY"")
- LETTER OF AWARD (""LOA"") TOTALING RM496.6 MILLION TO INTA BINA SDN BHD",1/10/2020,INTA BINA GROUP BERHAD,GA1-01102020-00091,https://disclosure.bursamalaysia.com/FileAccess/viewHtml/?e=3093047,General Announcement,OTHERS
"OTHERS K-STAR SPORTS LIMITED (""K-STAR"" OR THE ""COMPANY"")
- CHANGE IN THE COMPOSITION OF THE BOARD AND BOARD COMMITTEES",1/10/2020,K-STAR SPORTS LIMITED,GA1-24092020-00102,https://disclosure.bursamalaysia.com/FileAccess/viewHtml/?e=3093061,General Announcement,OTHERS
PRACTICE NOTE 17 / GUIDANCE NOTE 3 : MONTHLY ANNOUNCEMENT,1/10/2020,SCOMI ENERGY SERVICES BHD,GA1-01102020-00070,https://disclosure.bursamalaysia.com/FileAccess/viewHtml/?e=3093072,General Announcement,Practice Note 17 / Guidance Note 3
"NEW ISSUE OF SECURITIES (CHAPTER 6 OF LISTING REQUIREMENTS) : FUND RAISING ENCORP BERHAD (""ENCORP"" OR THE ""COMPANY"")
PRIVATE PLACEMENT OF UP TO 30,608,821 NEW ORDINARY SHARES IN ENCORP REPRESENTING UP TO 10% OF THE TOTAL NUMBER OF ISSUED SHARES OF ENCORP (EXCLUDING TREASURY SHARES) (""PLACEMENT"")",1/10/2020,ENCORP BERHAD,GA1-01102020-00132,https://disclosure.bursamalaysia.com/FileAccess/viewHtml/?e=3093091,General Announcement,New Issue of Securities (Chapter 6 of listing requirements)
"NEW ISSUE OF SECURITIES (CHAPTER 6 OF LISTING REQUIREMENTS) : FUND RAISING ECOBUILT HOLDINGS BERHAD (""ECOBUILT"" OR THE ""COMPANY"")
PRIVATE PLACEMENT OF UP TO 10% OF THE TOTAL NUMBER OF ISSUED SHARES OF ECOBUILT
(""PRIVATE PLACEMENT"")",2/10/2020,ECOBUILT HOLDINGS BERHAD,GA1-01102020-00028,https://disclosure.bursamalaysia.com/FileAccess/viewHtml/?e=3093148,General Announcement,New Issue of Securities (Chapter 6 of listing requirements)
"MULTIPLE PROPOSALS LYC HEALTHCARE BERHAD (""LYC OR THE ""COMPANY"")
I. PROPOSED PRIVATE PLACEMENT;
II. PROPOSED ACQUISITION OF T&T; AND
III. PROPOSED ACQUISITION OF HCOS
(COLLECTIVELY, THE ""PROPOSALS"")",2/10/2020,LYC HEALTHCARE BERHAD,GA1-02102020-00026,https://disclosure.bursamalaysia.com/FileAccess/viewHtml/?e=3093149,General Announcement,Multiple Proposals
PRACTICE NOTE 17 / GUIDANCE NOTE 3 : MONTHLY ANNOUNCEMENT,2/10/2020,ASIA MEDIA GROUP BERHAD,GA1-03082020-00104,https://disclosure.bursamalaysia.com/FileAccess/viewHtml/?e=3093157,General Announcement,Practice Note 17 / Guidance Note 3
PRACTICE NOTE 17 / GUIDANCE NOTE 3 : MONTHLY ANNOUNCEMENT,2/10/2020,NATIONWIDE EXPRESS HOLDINGS BERHAD,GA1-02102020-00036,https://disclosure.bursamalaysia.com/FileAccess/viewHtml/?e=3093166,General Announcement,Practice Note 17 / Guidance Note 3
OTHERS MONTHLY ANNOUNCEMENT ON THE STATUS OF DEFAULT IN PAYMENT PURSUANT TO RULE 9.19A OF THE MAIN MARKET LISTING REQUIREMENTS OF BURSA MALAYSIA SECURITIES BERHAD,2/10/2020,ZECON BERHAD,GA1-04082020-00073,https://disclosure.bursamalaysia.com/FileAccess/viewHtml/?e=3093189,General Announcement,OTHERS
MEMORANDUM OF UNDERSTANDING Memorandum of Understanding between Tex Cycle (P2) Sdn Bhd and Usaha Strategik Sdn Bhd,2/10/2020,TEX CYCLE TECHNOLOGY (M) BERHAD,GA1-02102020-00044,https://disclosure.bursamalaysia.com/FileAccess/viewHtml/?e=3093190,General Announcement,Memorandum of Understanding
MEMORANDUM OF UNDERSTANDING Memorandum of Understanding between Culzean W2E Limited and Medisort Limited,2/10/2020,TEX CYCLE TECHNOLOGY (M) BERHAD,GA1-02102020-00043,https://disclosure.bursamalaysia.com/FileAccess/viewHtml/?e=3093191,General Announcement,Memorandum of Understanding
"OTHERS CHANGE OF NAME OF WHOLLY-OWNED SUBSIDIARY, K-ONE RESOURCES SDN. BHD. TO K-ONE MEDITECH SDN. BHD.",2/10/2020,K-ONE TECHNOLOGY BERHAD,GA1-01102020-00031,https://disclosure.bursamalaysia.com/FileAccess/viewHtml/?e=3093202,General Announcement,OTHERS
"TRANSACTIONS (CHAPTER 10 OF LISTING REQUIREMENTS) : NON RELATED PARTY TRANSACTIONS CAHYA MATA SARAWAK BERHAD (""CMSB"" OR ""COMPANY"")
PROPOSED DISPOSALS",2/10/2020,CAHYA MATA SARAWAK BERHAD,GA1-29092020-00040,https://disclosure.bursamalaysia.com/FileAccess/viewHtml/?e=3093203,General Announcement,Transactions (Chapter 10 of Listing Requirements)
OTHERS CHANGE OF COMPANY'S NAME AT SUBSIDIARY LEVEL,2/10/2020,POLY GLASS FIBRE (M) BERHAD,GA1-29092020-00010,https://disclosure.bursamalaysia.com/FileAccess/viewHtml/?e=3093205,General Announcement,OTHERS
"TRANSACTIONS (CHAPTER 10 OF LISTING REQUIREMENTS) : NON RELATED PARTY TRANSACTIONS WIDAD GROUP BERHAD (""WIDAD"" OR ""COMPANY"")
(I)	PROPOSED ACQUISITION OF 90% EQUITY INTEREST IN SERENDAH HEIGHTS SDN BHD (""SHSB"") BY WIDAD FROM PRIHATIN EHSAN HOLDINGS SDN BHD (""PEHSB"") AND TRAINING CAMP AABATA SDN BHD (""TCASB"") (""PROPOSED ACQUISITION 1""); AND
(II)	PROPOSED ACQUISITION OF 10% EQUITY INTEREST IN SHSB BY WIDAD FROM JUST WISDOM SDN BHD (""PROPOSED ACQUISITION 2"")
(COLLECTIVELY, THE ""PROPOSED ACQUSITIONS"")",2/10/2020,WIDAD GROUP BERHAD,GA1-02102020-00012,https://disclosure.bursamalaysia.com/FileAccess/viewHtml/?e=3093252,General Announcement,Transactions (Chapter 10 of Listing Requirements)
"NEW ISSUE OF SECURITIES (CHAPTER 6 OF LISTING REQUIREMENTS) : FUND RAISING WMG HOLDINGS BHD. (""WMG"" OR ""COMPANY"")
PROPOSED SPECIAL ISSUE OF UP TO 55,070,000 NEW ORDINARY SHARES IN WMG TO BUMIPUTERA INVESTORS TO BE IDENTIFIED AND RECOGNISED BY THE MINISTRY OF INTERNATIONAL TRADE AND INDUSTRY (""PROPOSED SPECIAL ISSUE"")",2/10/2020,WMG HOLDINGS BERHAD,GA1-02102020-00045,https://disclosure.bursamalaysia.com/FileAccess/viewHtml/?e=3093254,General Announcement,New Issue of Securities (Chapter 6 of listing requirements)
"TRANSACTIONS (CHAPTER 10 OF LISTING REQUIREMENTS) : NON RELATED PARTY TRANSACTIONS YBS INTERNATIONAL BERHAD (""YBS"" OR ""COMPANY"")
PROPOSED ACQUISITION BY ORIENTAL FASTECH MANUFACTURING SDN BHD, A WHOLLY-OWNED SUBSIDIARY OF YBS, OF A PIECE OF INDUSTRIAL LAND TOGETHER WITH THE BUILDING ERECTED THEREON KNOWN AS PLOT 300 AT PENANG SCIENCE PARK, PENANG FROM PENANG DEVELOPMENT CORPORATION FOR A TOTAL CASH CONSIDERATION OF RM24,029,874 (""PROPOSED ACQUISITION"")",2/10/2020,YBS INTERNATIONAL BERHAD,GA1-02102020-00049,https://disclosure.bursamalaysia.com/FileAccess/viewHtml/?e=3093263,General Announcement,Transactions (Chapter 10 of Listing Requirements)
"TRANSACTIONS (CHAPTER 10 OF LISTING REQUIREMENTS) : NON RELATED PARTY TRANSACTIONS KIM LOONG RESOURCES BERHAD (""KLRB"")
-ACQUISITION OF OIL PALM PLANTATION LANDS",2/10/2020,KIM LOONG RESOURCES BERHAD,GA1-22092020-00046,https://disclosure.bursamalaysia.com/FileAccess/viewHtml/?e=3093264,General Announcement,Transactions (Chapter 10 of Listing Requirements)
"OTHERS Chin Well Holdings Berhad (""Chin Well"" or ""the Company"") Proposed Share Buy-Back Renewal",2/10/2020,CHIN WELL HOLDINGS BERHAD,GA1-02102020-00018,https://disclosure.bursamalaysia.com/FileAccess/viewHtml/?e=3093278,General Announcement,OTHERS
OTHERS Bonia Corporation Berhad - Proposed renewal of shareholders' mandate to enable Bonia Corporation Berhad to purchase up to 10% of its total number of issued shares,2/10/2020,BONIA CORPORATION BERHAD,GA1-02102020-00039,https://disclosure.bursamalaysia.com/FileAccess/viewHtml/?e=3093281,General Announcement,OTHERS
STRATEGIC PARTNERSHIP AGREEMENT AND SUPPLY AGREEMENT (PARTNERSHIP),2/10/2020,INIX TECHNOLOGIES HOLDINGS BERHAD,GA1-02102020-00057,https://disclosure.bursamalaysia.com/FileAccess/viewHtml/?e=3093287,Reply to Query,-
"NEW ISSUE OF SECURITIES (CHAPTER 6 OF LISTING REQUIREMENTS) : BONUS ISSUES DATASONIC GROUP BERHAD (""DATASONIC"" OR ""COMPANY"")
BONUS ISSUE",2/10/2020,DATASONIC GROUP BERHAD,GA1-02102020-00054,https://disclosure.bursamalaysia.com/FileAccess/viewHtml/?e=3093295,General Announcement,New Issue of Securities (Chapter 6 of listing requirements)
"NEW ISSUE OF SECURITIES (CHAPTER 6 OF LISTING REQUIREMENTS) : FUND RAISING KEJURUTERAAN ASASTERA BERHAD (""KAB"" OR THE ""COMPANY"")
PRIVATE PLACEMENT",2/10/2020,KEJURUTERAAN ASASTERA BERHAD,GA1-02102020-00050,https://disclosure.bursamalaysia.com/FileAccess/viewHtml/?e=3093305,General Announcement,New Issue of Securities (Chapter 6 of listing requirements)
"NEW ISSUE OF SECURITIES (CHAPTER 6 OF LISTING REQUIREMENTS) : OTHER ISSUE OF SECURITIES WEGMANS HOLDINGS BERHAD
BONUS WARRANTS",2/10/2020,WEGMANS HOLDINGS BERHAD,GA1-02102020-00013,https://disclosure.bursamalaysia.com/FileAccess/viewHtml/?e=3093315,General Announcement,New Issue of Securities (Chapter 6 of listing requirements)
"NEW ISSUE OF SECURITIES (CHAPTER 6 OF LISTING REQUIREMENTS) : OTHER ISSUE OF SECURITIES GREATECH TECHNOLOGY BERHAD (""GREATECH TECHNOLOGY"" OR ""COMPANY"")
PROPOSED LTIP",2/10/2020,GREATECH TECHNOLOGY BERHAD,GA1-01102020-00153,https://disclosure.bursamalaysia.com/FileAccess/viewHtml/?e=3093339,General Announcement,New Issue of Securities (Chapter 6 of listing requirements)
"OTHERS UZMA BERHAD [REGISTRATION NO.: 200701011861 (769866-V)]
(""UZMA"" OR ""THE COMPANY"")
SHARES SUBSCRIPTION AND SHAREHOLDERS AGREEMENT ENTERED INTO BETWEEN UZMA RESOURCE SOLUTIONS SDN. BHD., A WHOLLY-OWNED SUBSIDIARY OF THE COMPANY AND DATO' NASRI BIN NASRUN",2/10/2020,UZMA BERHAD,GA1-02102020-00068,https://disclosure.bursamalaysia.com/FileAccess/viewHtml/?e=3093349,General Announcement,OTHERS
"NEW ISSUE OF SECURITIES (CHAPTER 6 OF LISTING REQUIREMENTS) : FUND RAISING LUSTER INDUSTRIES BHD. (""LUSTER"" OR THE ""COMPANY"")
PRIVATE PLACEMENT OF UP TO 20% OF THE TOTAL NUMBER OF ISSUED SHARES OF LUSTER (""PRIVATE PLACEMENT"")",2/10/2020,LUSTER INDUSTRIES BHD.,GA1-02102020-00082,https://disclosure.bursamalaysia.com/FileAccess/viewHtml/?e=3093351,General Announcement,New Issue of Securities (Chapter 6 of listing requirements)
"OTHERS MIKRO MSC BERHAD (""MIKRO"" OR ""THE COMPANY"")
PROPOSED FINAL SINGLE TIER DIVIDEND OF 0.05 SEN PER ORDINARY SHARE FOR THE FINANCIAL YEAR ENDED 30 JUNE 2020",2/10/2020,MIKRO MSC BERHAD,GA1-02102020-00058,https://disclosure.bursamalaysia.com/FileAccess/viewHtml/?e=3093375,General Announcement,OTHERS
"NEW ISSUE OF SECURITIES (CHAPTER 6 OF LISTING REQUIREMENTS) : FUND RAISING ONLY WORLD GROUP HOLDINGS BERHAD (""OWG"" OR ""COMPANY"") - RENOUNCEABLE RIGHTS ISSUE OF UP TO 160,259,996 NEW ORDINARY SHARES IN OWG (""OWG SHARE(S)"") (""RIGHTS SHARE(S)"") TOGETHER WITH UP TO 80,129,998 FREE DETACHABLE WARRANTS IN OWG (""WARRANTS B"") ON THE BASIS OF 2 RIGHTS SHARES TOGETHER WITH 1 FREE WARRANT B FOR EVERY 5 EXISTING OWG SHARES HELD BY THE SHAREHOLDERS OF THE COMPANY ON AN ENTITLEMENT DATE TO BE DETERMINED AND ANNOUNCED LATER (""RIGHTS ISSUE WITH WARRANTS"")",2/10/2020,ONLY WORLD GROUP HOLDINGS BERHAD,GA1-01102020-00152,https://disclosure.bursamalaysia.com/FileAccess/viewHtml/?e=3093381,General Announcement,New Issue of Securities (Chapter 6 of listing requirements)
"OTHERS FARLIM GROUP (MALAYSIA) BHD. (""FARLIM"" OR ""THE COMPANY"")
APPLICATION TO STRIKE-OFF DORMANT SUBSIDIARY PURSUANT TO SECTION 550 OF THE COMPANIES ACT 2016",2/10/2020,FARLIM GROUP (MALAYSIA) BHD,GA1-02102020-00034,https://disclosure.bursamalaysia.com/FileAccess/viewHtml/?e=3093395,General Announcement,OTHERS
"OTHERS KOTRA INDUSTRIES BERHAD ('KOTRA' OR 'THE COMPANY')
- PROPOSED RENEWAL OF SHAREHOLDERS' MANDATE FOR EXISTING AND ADDITIONAL RECURRENT RELATED PARTY TRANSACTIONS OF A REVENUE OR TRADING NATURE",2/10/2020,KOTRA INDUSTRIES BERHAD,GA1-02102020-00059,https://disclosure.bursamalaysia.com/FileAccess/viewHtml/?e=3093398,General Announcement,OTHERS
OTHERS MONEY LENDING LICENSE,2/10/2020,DUTALAND BERHAD,GA1-02102020-00090,https://disclosure.bursamalaysia.com/FileAccess/viewHtml/?e=3093400,General Announcement,OTHERS
"TRANSACTIONS (CHAPTER 10 OF LISTING REQUIREMENTS) : NON RELATED PARTY TRANSACTIONS BAHVEST RESOURCES BERHAD (""BAHVEST"" OR ""THE COMPANY"")
PROPOSED DISPOSAL BY PLENTIFUL HARVEST SDN BHD (""PHSB""), MARINE TERRACE SDN BHD (""MTSB""), WHOLLY-OWNED SUBSIDIARIES OF BAHVEST, AND PLENTIFUL EARNINGS SDN BHD (""PESB""), A WHOLLY-OWNED SUBSIDIARY OF PHSB, OF LIVE FISH AND CERTAIN ASSETS RELATING TO FISH BREEDING, OPERATION OF A FISH HATCHERY AND FISH REARING TO SYNERGY MULTI RESOURCES SDN BHD FOR A TOTAL CASH CONSIDERATION OF RM5.00 MILLION (""PROPOSED DISPOSAL"")",2/10/2020,BAHVEST RESOURCES BERHAD,GA1-02102020-00023,https://disclosure.bursamalaysia.com/FileAccess/viewHtml/?e=3093402,General Announcement,Transactions (Chapter 10 of Listing Requirements)
OTHERS PROPOSED RENEWAL OF SHAREHOLDERS' MANDATE FOR RECURRENT RELATED PARTY TRANSACTIONS OF A REVENUE OR TRADING NATURE,2/10/2020,HUME INDUSTRIES BERHAD,GA1-02102020-00067,https://disclosure.bursamalaysia.com/FileAccess/viewHtml/?e=3093403,General Announcement,OTHERS
"MULTIPLE PROPOSALS SUNWAY REAL ESTATE INVESTMENT TRUST (""SUNWAY REIT"")
I. PROPOSED ACQUISITION OF THE PINNACLE SUNWAY BY SUNWAY REIT FOR A CASH CONSIDERATION OF RM450.0 MILLION;
II. PROPOSED PRIVATE PLACEMENT TO RAISE GROSS PROCEEDS OF UP TO RM710.0 MILLION AT THE ISSUE PRICE TO BE DETERMINED LATER BY WAY OF BOOKBUILDING; AND
III. PROPOSED ESTABLISHMENT OF A DISTRIBUTION REINVESTMENT SCHEME",2/10/2020,SUNWAY REAL ESTATE INVESTMENT TRUST,GA1-02102020-00014,https://disclosure.bursamalaysia.com/FileAccess/viewHtml/?e=3093407,General Announcement,Multiple Proposals
OTHERS PROPOSED RENEWAL OF SHAREHOLDERS' MANDATE FOR RECURRENT RELATED PARTY TRANSACTIONS OF A REVENUE OR TRADING NATURE,2/10/2020,HONG LEONG INDUSTRIES BERHAD,GA1-02102020-00062,https://disclosure.bursamalaysia.com/FileAccess/viewHtml/?e=3093408,General Announcement,OTHERS
"NEW ISSUE OF SECURITIES (CHAPTER 6 OF LISTING REQUIREMENTS) : FUND RAISING SUNWAY BERHAD
RIGHTS ISSUE OF IRREDEEMABLE CONVERTIBLE PREFERENCE SHARES",2/10/2020,SUNWAY BERHAD,GA1-02102020-00055,https://disclosure.bursamalaysia.com/FileAccess/viewHtml/?e=3093417,General Announcement,New Issue of Securities (Chapter 6 of listing requirements)
